mal_id,title_default,title_japanese,score,rank,popularity,season,year,demographics,genres
21435,Yama no Susume Second Season,ヤマノススメ セカンドシーズン,7.56,1660.0,3771,summer,2014.0,"Adventure, Slice of Life",
21437,Buddy Complex,バディ・コンプレックス,7.12,3685.0,2270,winter,2014.0,"Action, Sci-Fi",
21439,Uta no☆Prince-sama♪ Maji Love Revolutions,うたの☆プリンスさまっ♪マジLOVEレボリューションズ,7.0,4235.0,2880,spring,2015.0,"Comedy, Romance",Josei
21447,Meitantei Rascal,めいたんてい ラスカル,,19406.0,15763,winter,2014.0,"Adventure, Mystery",Kids
21507,Soul Eater NOT!,ソウルイーターノット！,5.86,10169.0,1173,spring,2014.0,"Action, Comedy, Fantasy",Shounen
21511,Kantai Collection: KanColle,艦隊これくしょん -艦これ-,6.82,5025.0,1137,winter,2015.0,"Action, Sci-Fi",
21523,Baku Tech! Bakugan Gachi,爆TECH!爆丸ガチ,5.8,10459.0,11093,spring,2013.0,Action,Shounen
21561,Ryuugajou Nanana no Maizoukin,龍ヶ嬢七々々の埋蔵金,7.12,3671.0,1033,spring,2014.0,"Adventure, Mystery, Supernatural",
21563,Kamigami no Asobi,神々の悪戯,7.0,4222.0,1593,spring,2014.0,"Fantasy, Romance",Josei
21573,Senki Zesshou Symphogear GX,戦姫絶唱シンフォギアGX,7.45,2057.0,3252,summer,2015.0,"Action, Sci-Fi",
21603,Mekakucity Actors,メカクシティアクターズ,7.01,4177.0,519,spring,2014.0,"Sci-Fi, Supernatural",
21671,Keroro,ケロロ,6.88,4742.0,6570,spring,2014.0,"Comedy, Sci-Fi",Shounen
21677,Captain Earth,キャプテン・アース,6.4,7419.0,2717,spring,2014.0,"Action, Romance, Sci-Fi",
21681,Hanayamata,ハナヤマタ,7.31,2677.0,1977,summer,2014.0,Slice of Life,
21729,Cardfight!! Vanguard: Legion Mate-hen,カードファイト!! ヴァンガード レギオンメイト編,6.74,5460.0,5289,spring,2014.0,Action,
21743,Donten ni Warau,曇天に笑う,7.46,2024.0,1750,fall,2014.0,"Action, Supernatural",Shoujo
21809,Kenzen Robo Daimidaler,健全ロボ ダイミダラー,6.13,8818.0,2617,spring,2014.0,"Action, Comedy, Sci-Fi, Ecchi",Seinen
21821,Fuuun Ishin Dai☆Shougun,風雲維新ダイ☆ショーグン,5.66,11050.0,4311,spring,2014.0,Action,
21835,Majin Bone,マジンボーン,6.62,6155.0,6547,spring,2014.0,,
21843,Shingeki no Bahamut: Genesis,神撃のバハムート GENESIS,7.61,1468.0,562,fall,2014.0,"Action, Adventure, Fantasy",
21845,Ushinawareta Mirai wo Motomete,失われた未来を求めて,6.72,5579.0,2230,fall,2014.0,"Drama, Romance, Sci-Fi",
21851,Tesagure! Bukatsumono Encore,てさぐれ！部活もの あんこーる,7.01,4212.0,8627,winter,2014.0,Comedy,
21863,Mangaka-san to Assistant-san to The Animation,マンガ家さんとアシスタントさんと THE ANIMATION,7.09,3796.0,891,spring,2014.0,"Comedy, Ecchi",Seinen
21881,Sword Art Online II,ソードアート・オンライン II,6.71,5588.0,38,summer,2014.0,"Action, Adventure, Fantasy, Romance",
21939,Mushishi Zoku Shou,蟲師 続章,8.69,61.0,816,spring,2014.0,"Adventure, Mystery, Slice of Life, Supernatural",Seinen
21981,Pic-lele,ピクレレ,,17726.0,19486,winter,2014.0,,Kids
21995,Ao Haru Ride,アオハライド,7.63,1424.0,181,summer,2014.0,Romance,Shoujo
21997,Duel Masters Victory V,デュエル・マスターズ ビクトリーV,5.79,10485.0,12976,spring,2012.0,"Action, Adventure, Comedy, Fantasy",Kids
21999,Duel Masters Victory V3,デュエル・マスターズ ビクトリーV3,5.61,11253.0,12840,spring,2013.0,"Action, Adventure, Comedy, Fantasy",Kids
22013,Koukaku Kidoutai Nyuumon Arise,攻殻機動隊入門あらいず,6.67,5827.0,7240,winter,2014.0,Comedy,
22099,Hero Bank,ヒーローバンク,5.93,9862.0,10228,spring,2014.0,,Kids
22101,Soredemo Sekai wa Utsukushii,それでも世界は美しい,7.59,1555.0,770,spring,2014.0,"Adventure, Fantasy, Romance",Shoujo
22123,Inugami-san to Nekoyama-san,犬神さんと猫山さん,6.51,6744.0,2449,spring,2014.0,"Comedy, Girls Love",
22135,Ping Pong the Animation,ピンポン THE ANIMATION,8.62,88.0,588,spring,2014.0,"Award Winning, Drama, Sports",Seinen
22145,Kuroshitsuji: Book of Circus,黒執事 Book of Circus,8.06,559.0,568,summer,2014.0,"Action, Fantasy, Mystery",Shounen
22147,Amagi Brilliant Park,甘城ブリリアントパーク,7.46,2018.0,321,fall,2014.0,"Comedy, Fantasy",
22189,Futsuu no Joshikousei ga [Locodol] Yattemita.,普通の女子校生が【ろこどる】やってみた。,6.88,4780.0,3314,summer,2014.0,"Comedy, Slice of Life",
22199,Akame ga Kill!,アカメが斬る！,7.47,1968.0,29,summer,2014.0,"Action, Fantasy",Shounen
22215,Pretty Rhythm: All Star Selection,プリティーリズム・オールスターセレクション,6.49,6870.0,9620,spring,2014.0,Sports,
22225,Momo Kyun Sword,モモキュンソード,5.57,11408.0,3855,summer,2014.0,"Comedy, Fantasy, Ecchi",
22265,Free! Eternal Summer,Free!-Eternal Summer-,7.61,1485.0,559,summer,2014.0,Sports,
22273,Selector Infected WIXOSS,selector infected WIXOSS,7.21,3190.0,1565,spring,2014.0,Suspense,
22297,Fate/stay night: Unlimited Blade Works,Fate/stay night [Unlimited Blade Works],8.18,403.0,140,fall,2014.0,"Action, Fantasy, Supernatural",
22319,Tokyo Ghoul,東京喰種-トーキョーグール-,7.79,1014.0,10,summer,2014.0,"Action, Fantasy, Horror, Suspense",Seinen
22359,Sanzoku no Musume Ronja,山賊の娘ローニャ,7.06,3941.0,4079,fall,2014.0,Adventure,
22381,Nandaka Velonica,ナンダカベロニカ,5.93,9872.0,12493,winter,2014.0,"Comedy, Fantasy",Kids
22433,Break Blade,ブレイク ブレイド,7.24,3052.0,2188,spring,2014.0,"Action, Fantasy",Shounen
22465,KutsuDaru.,くつだる。,,16394.0,14706,spring,2014.0,"Fantasy, Slice of Life",Kids
22503,Washimo,わしも,5.66,11028.0,15509,winter,2014.0,"Comedy, Sci-Fi, Slice of Life",Kids
22507,Initial D Final Stage,頭文字 D Final Stage,8.29,283.0,1590,spring,2014.0,,Seinen
22535,Kiseijuu: Sei no Kakuritsu,寄生獣 セイの格率,8.33,244.0,42,fall,2014.0,"Action, Horror, Sci-Fi, Suspense",Seinen
22537,Yami Shibai 2,闇芝居 2期,6.5,6789.0,3196,summer,2014.0,"Avant Garde, Horror, Supernatural",
22541,Oniku Daisuki! Zeushi-kun,おにくだいすき! ゼウシくん,5.46,11744.0,15242,winter,2014.0,"Comedy, Gourmet",
22547,Blade & Soul,ブレイドアンドソウル,6.04,9340.0,1833,spring,2014.0,"Action, Adventure, Fantasy",
22585,Nukko.,ぬっこ。,,20021.0,18228,spring,2012.0,Comedy,
22663,Seiken Tsukai no World Break,聖剣使いの禁呪詠唱〈ワールドブレイク〉,6.76,5352.0,778,winter,2015.0,"Action, Fantasy, Romance",
22687,Terra Formars,TERRA FORMARS [テラフォーマーズ],6.99,4275.0,1063,fall,2014.0,"Action, Horror, Sci-Fi, Suspense",Seinen
22693,Lady Jewelpet,レディ ジュエルペット,7.45,2047.0,6057,spring,2014.0,"Fantasy, Romance",
22729,Aldnoah.Zero,アルドノア・ゼロ,7.39,2326.0,440,summer,2014.0,"Action, Sci-Fi",
22733,Dragon Collection,ドラゴンコレクション,6.13,8846.0,8220,spring,2014.0,Fantasy,
22735,Oreca Battle,オレカバトル,5.89,10029.0,10641,spring,2014.0,,
22755,Chikasugi Idol Akae-chan,地下すぎアイドル あかえちゃん,,19208.0,17294,winter,2014.0,Comedy,
22777,Dragon Ball Kai (2014),ドラゴンボール改,7.7,1249.0,1247,spring,2014.0,"Action, Adventure, Comedy, Fantasy",Shounen
22789,Barakamon,ばらかもん,8.37,211.0,315,summer,2014.0,Slice of Life,
22817,Kindaichi Shounen no Jikenbo Returns,金田一少年の事件簿R【リターンズ】,7.53,1766.0,5049,spring,2014.0,Mystery,Shounen
22821,Himitsukessha Taka no Tsume EX,秘密結社鷹の爪 EX,,20460.0,15563,spring,2014.0,Comedy,
22831,Abarenbou Rikishi!! Matsutarou,暴れん坊力士！！松太郎,6.07,9169.0,6612,spring,2014.0,Sports,Seinen
22835,Himegoto,ひめゴト,5.89,10063.0,1792,summer,2014.0,"Comedy, Ecchi",Shounen
22849,Nyamen,にゃ〜めん,5.44,11791.0,12463,winter,2014.0,Comedy,
22865,Rokujouma no Shinryakusha!?,六畳間の侵略者！？,7.12,3670.0,1341,summer,2014.0,"Comedy, Supernatural",
22877,Seireitsukai no Blade Dance,精霊使いの剣舞〈ブレイドダンス〉,6.67,5845.0,656,summer,2014.0,"Action, Comedy, Fantasy, Romance, Ecchi",
22955,Francesca,フランチェスカ,5.45,11775.0,6517,summer,2014.0,"Comedy, Fantasy",
23037,Bakumatsu Rock,幕末Rock,6.03,9355.0,4127,summer,2014.0,"Action, Comedy",
23067,Tenkai Knights,テンカイナイト,6.44,7134.0,8304,spring,2014.0,"Action, Adventure, Comedy, Sci-Fi",Kids
23079,Glasslip,グラスリップ,5.42,11861.0,1444,summer,2014.0,"Romance, Supernatural",
23107,GO-GO Tamagotchi!,GO-GO たまごっち！,6.11,8943.0,14612,spring,2014.0,"Comedy, Fantasy",Kids
23121,Jinsei,人生相談テレビアニメーション「人生」,6.46,7017.0,2623,summer,2014.0,"Comedy, Slice of Life",
23133,M3: Sono Kuroki Hagane,M3～ソノ黒キ鋼～,6.56,6481.0,2980,spring,2014.0,"Action, Drama, Mystery, Sci-Fi, Suspense",
23149,47 Todoufuken R,47都道府犬R,5.54,11476.0,15649,winter,2014.0,Comedy,Kids
23151,Shounen Hollywood: Holly Stage for 49,少年ハリウッド-HOLLY STAGE FOR 49-,6.06,9231.0,5414,summer,2014.0,,
23199,Durarara!!x2 Shou,デュラララ!!×２ 承,7.97,678.0,471,winter,2015.0,"Action, Mystery, Supernatural",
23201,Sengoku Basara: Judge End,戦国BASARA Judge End,6.84,4970.0,4161,summer,2014.0,"Action, Fantasy",
23209,Sora no Method,天体のメソッド,6.76,5352.0,2008,fall,2014.0,"Drama, Fantasy",
23213,Kantoku Fuyuki Todoki,監督不行届,5.87,10135.0,7473,spring,2014.0,"Comedy, Slice of Life",Josei
23229,Meshimase Lodoss-tou Senki: Sorette Oishii no?,召しませロードス島戦記～それっておいしいの？～,5.42,11867.0,10566,spring,2014.0,Comedy,
23233,Shinmai Maou no Testament,新妹魔王の契約者〈テスタメント〉,6.69,5744.0,304,winter,2015.0,"Action, Fantasy, Romance, Ecchi",
23251,Gugure! Kokkuri-san,繰繰れ！コックリさん,7.55,1695.0,1325,fall,2014.0,"Comedy, Supernatural",Shounen
23259,Gundam: G no Reconguista,ガンダム Gのレコンギスタ,5.8,10470.0,3998,fall,2014.0,"Action, Sci-Fi",
23269,Hello!! Kiniro Mosaic,ハロー!!きんいろモザイク,7.49,1918.0,2449,spring,2015.0,Slice of Life,
23273,Shigatsu wa Kimi no Uso,四月は君の嘘,8.64,76.0,23,fall,2014.0,"Drama, Romance",Shounen
23277,Saenai Heroine no Sodatekata,冴えない彼女〈ヒロイン〉の育てかた,7.48,1948.0,316,winter,2015.0,"Comedy, Romance, Ecchi",
23281,Psycho-Pass 2,PSYCHO-PASS サイコパス 2,7.4,2293.0,325,fall,2014.0,"Action, Mystery, Sci-Fi, Suspense",
23283,Zankyou no Terror,残響のテロル,8.08,526.0,122,summer,2014.0,"Mystery, Suspense",
23289,Gekkan Shoujo Nozaki-kun,月刊少女野崎くん,7.82,952.0,183,summer,2014.0,"Comedy, Romance",
23309,Rail Wars!,RAIL WARS! [レールウォーズ],6.39,7470.0,1166,summer,2014.0,"Action, Ecchi",
23311,Garo: Honoo no Kokuin,牙狼〈GARO〉-炎の刻印-,7.34,2523.0,1610,fall,2014.0,"Action, Fantasy",
23321,Log Horizon 2nd Season,ログ・ホライズン 第2シリーズ,7.56,1657.0,356,fall,2014.0,"Action, Adventure, Fantasy",
23325,Shirogane no Ishi: Argevollen,白銀の意思 アルジェヴォルン,6.48,6936.0,3405,summer,2014.0,Action,
23327,Space☆Dandy 2nd Season,スペース☆ダンディ 第2シリーズ,8.26,308.0,1417,summer,2014.0,"Comedy, Sci-Fi",
23333,DRAMAtical Murder,ドラマティカル マーダー,6.05,9272.0,1423,summer,2014.0,"Action, Mystery, Sci-Fi",
23375,Minarai Diva,みならいディーバ,5.27,12263.0,11568,summer,2014.0,,
23409,Duel Masters VS,デュエル・マスターズ VS,5.73,10737.0,12378,spring,2014.0,"Action, Adventure, Comedy, Fantasy",Kids
23421,Re:␣Hamatora,Re:␣ ハマトラ,7.34,2545.0,1411,summer,2014.0,"Action, Mystery, Supernatural",
23433,Shin Strange+,真 ストレンジ・プラス,6.18,8569.0,5592,summer,2014.0,Comedy,Josei
23511,Choubakuretsu Ijigen Menko Battle: Gigant Shooter Tsukasa,超爆裂異次元メンコバトル ギガントシューター つかさ,5.48,11681.0,15430,spring,2014.0,"Action, Comedy",Kids
23551,Choboraunyopomi Gekijou Dai Ni Maku Ai Mai Mii: Mousou Catastrophe,ちょぼらうにょぽみ劇場第二幕 あいまいみー ~妄想カタストロフ~,5.95,9766.0,5853,summer,2014.0,Comedy,
23555,Neko no Dayan,猫のダヤン,,17314.0,14828,spring,2014.0,Fantasy,Kids
23587,The iDOLM@STER Cinderella Girls,アイドルマスター シンデレラガールズ,7.16,3444.0,2507,winter,2015.0,"Comedy, Drama",
23623,Non Non Biyori Repeat,のんのんびより りぴーと,8.18,412.0,1211,summer,2015.0,Slice of Life,Seinen
23673,Ookami Shoujo to Kuro Ouji,オオカミ少女と黒王子,7.01,4212.0,482,fall,2014.0,"Comedy, Romance",Shoujo
23721,Carino Coni,カリーノ・コニ,5.87,10132.0,16213,spring,2014.0,Fantasy,Kids
23755,Nanatsu no Taizai,七つの大罪,7.63,1419.0,32,fall,2014.0,"Action, Adventure, Fantasy",Shounen
23787,Hi☆sCoool! SeHa Girls,Hi☆sCoool! セハガール,6.49,6888.0,6056,fall,2014.0,Comedy,
23847,Yahari Ore no Seishun Love Comedy wa Machigatteiru. Zoku,やはり俺の青春ラブコメはまちがっている。続,8.2,382.0,142,spring,2015.0,"Comedy, Romance",
23897,Lovely Movie: Itoshi no Muco,ラブリームービー いとしのムーコ,6.41,7361.0,12330,summer,2013.0,Slice of Life,
23901,Lovely Movie: Itoshi no Muco Season 2,ラブリームービー いとしのムーコ シーズン２,6.13,8814.0,13884,spring,2014.0,Slice of Life,
23945,Majimoji Rurumo,まじもじるるも,6.83,4989.0,2555,summer,2014.0,"Comedy, Fantasy, Ecchi",Shounen
24011,Lance N' Masques,ランス・アンド・マスクス,5.49,11645.0,3174,fall,2015.0,Fantasy,
24031,Denki-gai no Honya-san,デンキ街の本屋さん,7.18,3372.0,1750,fall,2014.0,Comedy,Seinen
24037,Selector Spread WIXOSS,selector spread WIXOSS,7.35,2489.0,2468,fall,2014.0,Suspense,
24075,Persona 4 the Golden Animation,ペルソナ4 ザ・ゴールデンアニメーション,6.62,6164.0,2214,summer,2014.0,"Adventure, Mystery, Sci-Fi, Supernatural",
24133,Taimadou Gakuen 35 Shiken Shoutai,対魔導学園35試験小隊,6.8,5133.0,781,fall,2015.0,"Action, Fantasy, Romance, Ecchi",
24135,Nobunaga Concerto,信長協奏曲〈コンツェルト〉,7.52,1820.0,2904,summer,2014.0,"Comedy, Romance",Shounen
24211,Orenchi no Furo Jijou,オレん家のフロ事情,6.94,4485.0,1936,fall,2014.0,"Comedy, Fantasy",Josei
24231,Hitsugi no Chaika: Avenging Battle,棺姫のチャイカ AVENGING BATTLE,7.16,3468.0,1190,fall,2014.0,"Action, Adventure, Fantasy, Romance",
24277,Yowamushi Pedal: Grande Road,弱虫ペダル GRANDE ROAD,8.05,574.0,1642,fall,2014.0,Sports,Shounen
24403,Nyanpuku Nyaruma,にゃんぷくにゃるま,,17462.0,16309,,,Comedy,
24415,Kuroko no Basket 3rd Season,黒子のバスケ,8.29,277.0,259,winter,2015.0,Sports,Shounen
24417,Maido! Urayasu Tekkin Kazoku,毎度！浦安鉄筋家族,6.13,8816.0,12867,summer,2014.0,Comedy,Shounen
24439,Kekkai Sensen,血界戦線,7.59,1553.0,198,spring,2015.0,"Action, Fantasy",Shounen
24455,Madan no Ou to Vanadis,魔弾の王と戦姫 (ヴァナディース),7.1,3782.0,663,fall,2014.0,"Action, Adventure, Fantasy, Ecchi",
24625,Gundam Build Fighters Try,ガンダムビルドファイターズトライ,7.2,3237.0,3357,fall,2014.0,"Action, Sci-Fi",
24629,Koufuku Graffiti,幸腹グラフィティ,6.8,5132.0,2443,winter,2015.0,"Gourmet, Slice of Life",Seinen
24699,Ai Tenchi Muyou!,愛・天地無用!,6.14,8769.0,3784,fall,2014.0,"Comedy, Sci-Fi",
24701,Mushishi Zoku Shou 2nd Season,蟲師 続章,8.72,53.0,921,fall,2014.0,"Adventure, Mystery, Slice of Life, Supernatural",Seinen
24703,High School DxD BorN,ハイスクールD×D BorN,7.42,2204.0,238,spring,2015.0,"Action, Comedy, Fantasy, Romance, Ecchi",
24705,"Ore, Twintail ni Narimasu.",俺、ツインテールになります。,6.42,7303.0,1487,fall,2014.0,"Action, Comedy, Fantasy, Romance",
24765,Gakkougurashi!,がっこうぐらし！,7.61,1488.0,503,summer,2015.0,"Horror, Mystery, Slice of Life, Supernatural, Suspense",
24797,Kubire 3 Shimai,くびれ3姉妹,,16346.0,20662,,,Comedy,
24833,Ansatsu Kyoushitsu,暗殺教室,8.08,527.0,33,winter,2015.0,"Action, Comedy",Shounen
24835,Kidou Senshi Gundam-san,機動戦士ガンダムさん,6.17,8645.0,7100,summer,2014.0,Comedy,
24855,Girlfriend (Kari),ガールフレンド(仮),5.91,9935.0,3426,fall,2014.0,Slice of Life,
24873,Juuou Mujin no Fafnir,銃皇無尽のファフニール,6.16,8671.0,1505,winter,2015.0,"Action, Fantasy, Romance",
24893,Sidonia no Kishi: Daikyuu Wakusei Seneki,シドニアの騎士 第九惑星戦役,7.72,1193.0,1865,spring,2015.0,"Action, Sci-Fi",Seinen
24909,Kaitou Joker,怪盗ジョーカー,6.97,4341.0,5538,fall,2014.0,"Adventure, Comedy, Mystery",Kids
24969,Sumiko (TV),スミ子 (2014),,13990.0,17459,summer,2014.0,"Comedy, Slice of Life",Kids
25013,Akatsuki no Yona,暁のヨナ,8.03,594.0,207,fall,2014.0,"Action, Adventure, Fantasy, Romance",Shoujo
25099,"Ore ga Ojousama Gakkou ni ""Shomin Sample"" Toshite Gets♥Sareta Ken",俺がお嬢様学校に「庶民サンプル」としてゲッツされた件,6.67,5838.0,886,fall,2015.0,"Comedy, Romance, Ecchi",
25157,Trinity Seven,トリニティセブン,7.04,4025.0,215,fall,2014.0,"Action, Comedy, Fantasy, Romance, Ecchi",Shounen
25159,Inou-Battle wa Nichijou-kei no Naka de,異能バトルは日常系のなかで,7.05,3989.0,545,fall,2014.0,"Comedy, Supernatural",
25183,Gangsta.,GANGSTA. ギャングスタ,7.41,2214.0,382,summer,2015.0,"Action, Drama",Seinen
25283,Kuusen Madoushi Kouhosei no Kyoukan,空戦魔導士候補生の教官,6.31,7852.0,954,summer,2015.0,"Action, Drama, Fantasy",
25397,Absolute Duo,アブソリュート・デュオ,6.42,7261.0,400,winter,2015.0,"Action, Fantasy, Romance, Ecchi",
25429,Isuca,ISUCA [イスカ],5.97,9645.0,1571,winter,2015.0,"Action, Comedy, Romance, Supernatural, Ecchi",Seinen
25503,Fuusen Inu Tinny,ふうせんいぬティニー,,19945.0,16601,fall,2014.0,Adventure,Kids
25517,Magic Kaito 1412,まじっく快斗1412,7.86,868.0,1784,fall,2014.0,"Adventure, Comedy, Romance",Shounen
25519,Yuuki Yuuna wa Yuusha de Aru,結城友奈は勇者である,7.37,2384.0,1521,fall,2014.0,"Drama, Fantasy",
25649,Junjou Romantica 3,純情ロマンチカ 3,7.6,1516.0,1836,summer,2015.0,"Boys Love, Comedy, Drama",
25681,Kamisama Hajimemashita◎,神様はじめました◎,8.22,348.0,559,winter,2015.0,"Comedy, Fantasy, Romance",Shoujo
25731,Cross Ange: Tenshi to Ryuu no Rondo,クロスアンジュ 天使と竜の輪舞〈ロンド〉,7.38,2350.0,1185,fall,2014.0,"Action, Fantasy, Sci-Fi",
25835,Shirobako,SHIROBAKO,8.27,294.0,513,fall,2014.0,"Award Winning, Comedy, Drama",
25859,Re-Kan!,レーカン！,6.76,5344.0,2872,spring,2015.0,"Comedy, Supernatural",
25867,Rolling☆Girls,ローリング☆ガールズ,6.58,6345.0,2273,winter,2015.0,"Action, Adventure, Sci-Fi",
25879,Working!!!,ワーキング!!!,7.95,707.0,995,summer,2015.0,"Comedy, Romance",Seinen
25939,Mahou Shoujo Lyrical Nanoha ViVid,魔法少女リリカルなのはViVid,6.72,5575.0,4353,spring,2015.0,"Action, Adventure",
25999,Minna Atsumare! Falcom Gakuen SC,みんな集まれ！ファルコム学園ＳＣ,6.07,9145.0,9639,winter,2015.0,Comedy,Seinen
26055,JoJo no Kimyou na Bouken Part 3: Stardust Crusaders 2nd Season,ジョジョの奇妙な冒険 スターダストクルセイダース エジプト編,8.44,163.0,132,winter,2015.0,"Action, Adventure, Supernatural",Shounen
26085,Military!,みりたり!,5.79,10502.0,3468,winter,2015.0,"Comedy, Slice of Life, Ecchi",
26163,Ganbare! Lulu Lolo 2nd Season,がんばれ！ルルロロ　第２シリーズ,,19990.0,17873,fall,2014.0,Slice of Life,Kids
26165,Yuri Kuma Arashi,ユリ熊嵐,7.04,4031.0,2076,winter,2015.0,"Avant Garde, Drama, Fantasy, Girls Love, Ecchi",
26243,Owari no Seraph,終わりのセラフ,7.48,1945.0,101,spring,2015.0,"Action, Drama, Fantasy",Shounen
26349,Danna ga Nani wo Itteiru ka Wakaranai Ken,旦那が何を言っているかわからない件,7.28,2813.0,679,fall,2014.0,"Comedy, Romance",
26351,Nagato Yuki-chan no Shoushitsu,長門有希ちゃんの消失,6.72,5577.0,1667,spring,2015.0,"Comedy, Romance",Seinen
26395,Teekyuu 4,てーきゅう ４期,6.67,5825.0,4684,spring,2015.0,Comedy,Shounen
26441,Junketsu no Maria,純潔のマリア,7.11,3718.0,1530,winter,2015.0,"Comedy, Fantasy, Romance",Seinen
26443,Triage X,トリアージX,6.31,7880.0,1443,spring,2015.0,"Action, Adventure, Ecchi",Shounen
26453,Tribe Cool Crew,トライブクルクル,6.87,4837.0,8454,fall,2014.0,Sports,
27441,Show By Rock!!,SHOW BY ROCK!!（ショウ・バイ・ロック!!）,7.03,4090.0,2317,spring,2015.0,"Comedy, Fantasy",
27457,Porong Porong Pororo 4,뽀롱뽀롱 뽀로로 4,5.48,11691.0,16097,winter,2012.0,,Kids
27459,Porong Porong Pororo 5,뽀롱뽀롱 뽀로로 5,5.63,11194.0,16239,winter,2014.0,,Kids
27519,Konna Watashitachi ga Nariyuki de Heroine ni Natta Kekka www (TV),こんな私たちがなりゆきでヒロインになった結果www,5.66,11059.0,14766,fall,2014.0,Comedy,
27521,Gra-P & Rodeo,ぐらＰ＆ろで夫,,20126.0,16399,fall,2014.0,Comedy,
27525,Fate/kaleid liner Prisma☆Illya 2wei Herz!,Fate/kaleid liner プリズマ☆イリヤ ツヴァイ ヘルツ！,7.16,3463.0,1608,summer,2015.0,"Action, Comedy, Fantasy",
27589,47 Todoufuken,47都道府犬,5.32,12139.0,15374,spring,2011.0,Comedy,Kids
27621,Glass no Kamen desu ga to Z,ガラスの仮面ですが と Z,5.84,10262.0,13746,spring,2013.0,Comedy,Shoujo
27629,Tantei Kageki Milky Holmes TD,探偵歌劇ミルキィホームズTD,6.44,7133.0,6635,winter,2015.0,"Comedy, Mystery",
27655,Aldnoah.Zero Part 2,アルドノア・ゼロ（第2クール）,6.91,4633.0,786,winter,2015.0,"Action, Sci-Fi",
27663,Baby Steps 2nd Season,ベイビーステップ 第2シリーズ,8.01,618.0,2261,spring,2015.0,Sports,Shounen
27687,Oshiri Kajiri Mushi (TV) 3rd Season,おしりかじり虫　第３シリーズ,5.12,12580.0,14789,fall,2014.0,Comedy,Kids
27727,Binan Koukou Chikyuu Bouei-bu LOVE!,美男高校地球防衛部LOVE!,6.82,5052.0,2384,winter,2015.0,Comedy,
27741,Shounen Hollywood: Holly Stage for 50,少年ハリウッド-HOLLY STAGE FOR 50-,6.47,6958.0,7507,winter,2015.0,,
27757,Anisava,ANISAVA,5.5,11617.0,14224,summer,2013.0,"Comedy, Romance",
27775,Plastic Memories,プラスティック・メモリーズ,7.91,774.0,172,spring,2015.0,"Drama, Romance, Sci-Fi",
27785,Doamaiger D,ドアマイガーD,5.31,12151.0,11249,winter,2015.0,"Action, Comedy, Gourmet",
27787,Nisekoi:,ニセコイ,7.34,2539.0,292,spring,2015.0,"Comedy, Romance",Shounen
27815,Cardfight!! Vanguard G,カードファイト!! ヴァンガードG,6.53,6643.0,5328,fall,2014.0,Action,
27831,Durarara!!x2 Ten,デュラララ!!×２ 転,7.96,691.0,592,summer,2015.0,"Action, Mystery, Supernatural",
27899,Tokyo Ghoul √A,東京喰種√A,7.02,4163.0,49,winter,2015.0,"Action, Fantasy, Horror, Suspense",Seinen
27927,Urawa no Usagi-chan,浦和の調ちゃん,5.38,11983.0,5206,spring,2015.0,Comedy,
27943,Nano Invaders,ナノ・インベーダーズ,,17285.0,12841,fall,2014.0,"Action, Adventure",
27989,Hibike! Euphonium,響け！ユーフォニアム,8.02,617.0,486,spring,2015.0,Drama,
27991,K: Return of Kings,K RETURN OF KINGS,7.55,1683.0,728,fall,2015.0,"Action, Fantasy",
28121,Dungeon ni Deai wo Motomeru no wa Machigatteiru Darou ka,ダンジョンに出会いを求めるのは間違っているだろうか,7.54,1744.0,75,spring,2015.0,"Action, Adventure, Fantasy",
28155,Yoru no Yatterman,夜ノヤッターマン,6.5,6786.0,3980,winter,2015.0,"Action, Adventure, Comedy, Drama",
28171,Shokugeki no Souma,食戟のソーマ,8.13,471.0,61,spring,2015.0,"Gourmet, Ecchi",Shounen
28207,Ketsuekigata-kun! 2,血液型くん！2,6.38,7473.0,8486,winter,2015.0,Comedy,
28221,Etotama,えとたま（干支魂）,6.78,5234.0,2439,spring,2015.0,"Action, Comedy, Fantasy",
28223,Death Parade,デス・パレード,8.14,458.0,48,winter,2015.0,"Drama, Supernatural, Suspense",
28247,Pankis! 2-jigen,ぱんきす! 2次元,5.62,11217.0,14721,winter,2015.0,Comedy,
28249,Arslan Senki (TV),アルスラーン戦記,7.65,1365.0,640,spring,2015.0,"Action, Adventure, Drama, Fantasy",Shounen
28283,Sengoku Musou,戦国無双,6.52,6698.0,4635,winter,2015.0,Action,
28297,Ore Monogatari!!,俺物語!!,7.9,781.0,305,spring,2015.0,"Comedy, Romance",Shoujo
28387,Joukamachi no Dandelion,城下町のダンデライオン,7.15,3502.0,1398,summer,2015.0,"Comedy, Supernatural",Seinen
28401,Q Transformers: Kaette Kita Convoy no Nazo,キュートランスフォーマー 帰ってきたコンボイの謎,5.38,11975.0,12900,winter,2015.0,Slice of Life,
28423,Kyoukai no Rinne,境界のRINNE,6.88,4753.0,2298,spring,2015.0,"Comedy, Supernatural",Shounen
28497,Rokka no Yuusha,六花の勇者,7.26,2962.0,341,summer,2015.0,"Action, Adventure, Fantasy, Mystery",
28595,Pac-World,パックワールド,5.44,11794.0,10373,spring,2014.0,"Adventure, Comedy, Sci-Fi",
28617,Punch Line,パンチライン,6.89,4734.0,1053,spring,2015.0,"Comedy, Sci-Fi, Supernatural, Ecchi",
28619,Ranpo Kitan: Game of Laplace,乱歩奇譚 Game of Laplace,6.58,6346.0,1875,summer,2015.0,"Mystery, Suspense",
28621,Subete ga F ni Naru,すべてがFになる THE PERFECT INSIDER,7.24,3027.0,1396,fall,2015.0,"Mystery, Sci-Fi, Suspense",
28677,Yamada-kun to 7-nin no Majo,山田くんと7人の魔女,7.53,1785.0,244,spring,2015.0,"Comedy, Mystery, Romance, Supernatural",Shounen
28701,Fate/stay night: Unlimited Blade Works 2nd Season,Fate/stay night [Unlimited Blade Works] 2nd シーズン,8.32,252.0,211,spring,2015.0,"Action, Fantasy, Supernatural",
28791,Gunslinger Stratos The Animation,ガンスリンガー ストラトス -THE ANIMATION-,6.04,9349.0,2595,spring,2015.0,"Action, Sci-Fi",
28817,Mikagura Gakuen Kumikyoku (TV),ミカグラ学園組曲,6.67,5832.0,2279,spring,2015.0,"Action, Comedy, Fantasy, Girls Love",
28819,Okusama ga Seitokaichou!,おくさまが生徒会長！,6.56,6445.0,822,summer,2015.0,"Comedy, Romance, Ecchi",Shounen
28825,Himouto! Umaru-chan,干物妹！うまるちゃん,7.1,3771.0,294,summer,2015.0,Comedy,Seinen
