mal_id,title_default,title_japanese,score,rank,popularity,season,year,demographics,genres
37283,Beyblade Burst Chouzetsu,ベイブレードバースト 超ゼツ,6.62,6118.0,5316,spring,2018.0,"Action, Adventure, Sci-Fi",Kids
37302,Kemurikusa (TV),ケムリクサ,7.04,4054.0,4027,winter,2019.0,"Fantasy, Sci-Fi",
37324,Youkai Watch: Shadow Side,妖怪ウォッチ シャドウサイド,6.7,5660.0,10397,spring,2018.0,"Comedy, Supernatural",Kids
37325,Kuroneko Monroe,黒猫モンロヲ,,16390.0,15061,spring,2018.0,Comedy,
37328,Oshiete Mahou no Pendulum: Rilu Rilu Fairilu,おしえて魔法のペンデュラム～リルリルフェアリル～,6.43,7218.0,12324,summer,2018.0,"Fantasy, Slice of Life",
37338,Chuukan Kanriroku Tonegawa,中間管理録トネガワ,7.17,3390.0,3508,summer,2018.0,"Comedy, Drama",Seinen
37345,Plunderer,プランダラ,6.64,5994.0,526,winter,2020.0,"Action, Fantasy, Romance, Ecchi",Shounen
37347,Dungeon ni Deai wo Motomeru no wa Machigatteiru Darou ka II,ダンジョンに出会いを求めるのは間違っているだろうかII,7.24,3058.0,226,summer,2019.0,"Action, Adventure, Fantasy",
37349,Goblin Slayer,ゴブリンスレイヤー,7.42,2202.0,129,fall,2018.0,"Action, Adventure, Fantasy",
37359,Kekkero Ke,ケッケロケー,,18627.0,16664,spring,2018.0,Comedy,
37368,Shounen Ashibe: Go! Go! Goma-chan 3,少年アシベ GO! GO! ゴマちゃん 3,5.72,10771.0,14335,spring,2018.0,"Comedy, Slice of Life",Seinen
37369,Neko Neko Nihonshi 3rd Season,ねこねこ日本史 第3期,6.26,8161.0,14739,spring,2018.0,,Kids
37374,Pastel Memories,ぱすてるメモリーズ,5.14,12536.0,4885,winter,2019.0,"Action, Adventure, Sci-Fi",
37379,Chihayafuru 3,ちはやふる 3,8.46,157.0,1624,fall,2019.0,"Drama, Sports",Josei
37388,Souten no Ken: Regenesis 2nd Season,蒼天の拳 REGENESIS 第2期,6.03,9392.0,8648,fall,2018.0,Action,Seinen
37393,"Watashi, Nouryoku wa Heikinchi de tte Itta yo ne!",私、能力は平均値でって言ったよね!,6.75,5442.0,1255,fall,2019.0,"Adventure, Comedy, Fantasy",
37395,Zoids Wild,ゾイドワイルド,6.34,7679.0,7580,summer,2018.0,"Action, Adventure, Comedy, Sci-Fi",
37403,Ahiru no Sora,あひるの空,7.26,2912.0,1219,fall,2019.0,Sports,Shounen
37422,Cinderella Girls Gekijou 3rd Season,シンデレラガールズ劇場 第3期,6.53,6644.0,7523,summer,2018.0,"Comedy, Slice of Life",
37426,Sarazanmai,さらざんまい,7.47,1997.0,1704,spring,2019.0,"Action, Fantasy, Supernatural",
37428,Chara to Otamajakushi Shima,キャラとおたまじゃくし島,,16541.0,18240,spring,2018.0,"Adventure, Fantasy",Kids
37430,Tensei shitara Slime Datta Ken,転生したらスライムだった件,8.14,453.0,83,fall,2018.0,"Action, Adventure, Comedy, Fantasy",Shounen
37433,Wakaokami wa Shougakusei!,若おかみは小学生！,6.62,6110.0,7242,spring,2018.0,"Comedy, Slice of Life, Supernatural",
37435,Carole & Tuesday,キャロル&チューズデイ,7.85,886.0,736,spring,2019.0,"Drama, Sci-Fi",
37436,Revisions,revisions リヴィジョンズ,6.02,9449.0,2765,winter,2019.0,"Action, Sci-Fi",
37438,Ingress the Animation,INGRESS THE ANIMATION,6.28,8083.0,4162,fall,2018.0,"Action, Mystery, Sci-Fi",
37446,Hyakuren no Haou to Seiyaku no Valkyria,百錬の覇王と聖約の戦乙女〈ヴァルキュリア〉,5.69,10924.0,1236,summer,2018.0,"Action, Adventure, Fantasy, Romance",
37447,Karakuri Circus,からくりサーカス,7.16,3471.0,1736,fall,2018.0,"Action, Adventure, Drama, Mystery",Shounen
37448,Ladyspo,レディスポ,2.99,13394.0,8913,spring,2018.0,"Comedy, Sci-Fi, Sports",
37450,Seishun Buta Yarou wa Bunny Girl Senpai no Yume wo Minai,青春ブタ野郎はバニーガール先輩の夢を見ない,8.23,339.0,52,fall,2018.0,"Drama, Romance, Supernatural",
37451,Boogiepop wa Warawanai (2019),ブギーポップは笑わない,7.07,3897.0,1077,winter,2019.0,"Avant Garde, Drama, Horror, Mystery, Supernatural, Suspense",
37458,Kyoto Teramachi Sanjou no Holmes,京都寺町三条のホームズ,6.74,5476.0,2751,summer,2018.0,"Drama, Mystery",
37467,Usagi no Matthew,うさぎのマシュー,,14536.0,14671,spring,2018.0,Slice of Life,
37472,Lalala Lala-chan: Lala to Mainichi,ラララ ララちゃん ～ララっとまいにち～,,16428.0,18230,winter,2019.0,"Adventure, Fantasy",Kids
37475,Kishuku Gakkou no Juliet,寄宿学校のジュリエット,7.45,2045.0,640,fall,2018.0,"Action, Comedy, Romance",Shounen
37476,Cardfight!! Vanguard (2018),カードファイト!! ヴァンガード (2018),6.73,5526.0,5686,spring,2018.0,Action,
37481,Ongaku Shoujo (TV),音楽少女,5.98,9588.0,5302,summer,2018.0,Slice of Life,
37484,Duel Masters!,デュエル・マスターズ!,5.77,10613.0,12356,spring,2018.0,"Action, Adventure, Comedy, Fantasy",Kids
37487,Muhyo to Rouji no Mahouritsu Soudan Jimusho,ムヒョとロージーの魔法律相談事務所,6.71,5644.0,3086,summer,2018.0,"Mystery, Supernatural",Shounen
37490,"Gyakuten Saiban: Sono ""Shinjitsu"", Igi Ari! Season 2",逆転裁判 ～その「真実」、異議あり！～ Season 2,7.17,3396.0,3502,fall,2018.0,"Comedy, Drama, Mystery",
37491,Gintama.: Shirogane no Tamashii-hen - Kouhan-sen,銀魂. 銀ノ魂篇 後半戦,8.88,24.0,1216,summer,2018.0,"Action, Comedy, Sci-Fi",Shounen
37496,Double Decker! Doug & Kirill,DOUBLE DECKER! ダグ＆キリル,6.81,5075.0,3751,fall,2018.0,"Action, Comedy, Mystery, Sci-Fi",
37497,Irozuku Sekai no Ashita kara,色づく世界の明日から,7.52,1809.0,715,fall,2018.0,"Drama, Fantasy, Romance",
37509,W'z,ウィズ,5.52,11565.0,4421,winter,2019.0,Action,
37510,Mob Psycho 100 II,モブサイコ100 II,8.79,34.0,74,winter,2019.0,"Action, Comedy, Supernatural",
37517,Happy Sugar Life,ハッピーシュガーライフ,6.77,5309.0,793,summer,2018.0,"Drama, Girls Love, Horror, Suspense",Shounen
37520,Dororo,どろろ,8.25,316.0,111,winter,2019.0,"Action, Adventure, Fantasy",Shounen
37521,Vinland Saga,ヴィンランド・サガ,8.76,44.0,73,summer,2019.0,"Action, Adventure, Drama",Seinen
37522,Pet,ペット,6.44,7177.0,2216,winter,2020.0,"Mystery, Supernatural, Suspense",Seinen
37525,Babylon,バビロン,6.74,5457.0,1507,fall,2019.0,"Mystery, Suspense",
37555,Hangyakusei Million Arthur,叛逆性ミリオンアーサー,6.01,9492.0,3543,fall,2018.0,"Action, Adventure, Fantasy",
37559,Oretacha Youkai Ningen G,俺たちゃ妖怪人間G,5.54,11487.0,14901,spring,2018.0,Horror,
37560,Mannaka no Rikkun@Kin Tele,まんなかのりっくん＠きんてれ,,16724.0,16430,winter,2019.0,Comedy,Seinen
37561,Akanesasu Shoujo,あかねさす少女,6.43,7224.0,3737,fall,2018.0,"Action, Sci-Fi",
37569,Sirius,天狼〈シリウス〉 Sirius the Jaeger,6.96,4398.0,994,summer,2018.0,"Action, Supernatural",
37571,Senjuushi,千銃士,4.91,12846.0,5712,summer,2018.0,Action,
37576,Majutsushi Orphen Hagure Tabi,魔術士オーフェンはぐれ旅,5.83,10286.0,2608,winter,2020.0,"Action, Adventure, Drama, Fantasy",
37578,Planet With,プラネット・ウィズ,7.15,3499.0,2936,summer,2018.0,"Action, Sci-Fi",
37579,Tonari no Kyuuketsuki-san,となりの吸血鬼さん,7.09,3816.0,2018,fall,2018.0,"Comedy, Supernatural",
37584,Bakumatsu,BAKUMATSU,5.73,10732.0,4546,fall,2018.0,Action,
37587,Lapis Re:LiGHTs,ラピスリライツ,6.65,5968.0,3291,summer,2020.0,Fantasy,
37597,Dakaretai Otoko 1-i ni Odosarete Imasu.,抱かれたい男1位に脅されています。,7.36,2447.0,1478,fall,2018.0,"Boys Love, Comedy, Drama",
37598,Phantom in the Twilight,ファントム イン ザ トワイライト,6.41,7336.0,3219,summer,2018.0,"Action, Supernatural",
37599,Magatsu Wahrheit: Zuerst,禍つヴァールハイト -ZUERST-,6.54,6582.0,3745,fall,2020.0,"Action, Fantasy",
37601,Lord of Vermilion: Guren no Ou,ロード オブ ヴァーミリオン　紅蓮の王,5.36,12044.0,3350,summer,2018.0,"Action, Fantasy",
37611,Future Card Buddyfight Battsu: All-Star Fight,フューチャーカード バディファイト バッツ オールスターファイト,6.76,5381.0,10303,spring,2018.0,,
37614,Hitoribocchi no Marumaru Seikatsu,ひとりぼっちの○○生活,7.48,1966.0,1119,spring,2019.0,Comedy,Shounen
37630,Washimo 6th Season,わしも-wasimo-(第6シリーズ),,14633.0,19402,spring,2018.0,"Comedy, Sci-Fi, Slice of Life",Kids
37646,Hataraku Oniisan! no 2!,働くお兄さん！の2！,6.41,7351.0,9444,summer,2018.0,Comedy,
37653,Caribadix 2nd Season,ディッキー&カリーナ 2ndシーズン,,19063.0,17886,spring,2018.0,Comedy,
37657,Gakuen Basara,学園BASARA,6.19,8549.0,5062,fall,2018.0,"Action, Comedy",
37662,Shinya! Tensai Bakabon,深夜！天才バカボン,5.97,9666.0,9756,summer,2018.0,"Comedy, Slice of Life",
37675,Overlord III,オーバーロードⅢ,7.92,755.0,188,summer,2018.0,"Action, Adventure, Fantasy",
37698,Ukkari Pénélope (2017),うっかりペネロペ,,14505.0,20172,fall,2017.0,Slice of Life,Kids
37716,Beelzebub-jou no Okinimesu mama.,ベルゼブブ嬢のお気に召すまま。,7.23,3072.0,2147,fall,2018.0,"Comedy, Fantasy, Romance",Shounen
37722,Uchi no Maid ga Uzasugiru!,うちのメイドがウザすぎる！,6.86,4887.0,1858,fall,2018.0,"Comedy, Girls Love",
37739,Future Card Shin Buddyfight,フューチャーカード 神バディファイト,6.38,7497.0,9590,summer,2018.0,,
37744,Isekai Cheat Magician,異世界チート魔術師〈マジシャン〉,5.47,11723.0,734,summer,2019.0,"Action, Adventure, Fantasy",
37747,Ame-iro Cocoa: Side G,雨色ココア side G,4.87,12883.0,6671,winter,2019.0,"Comedy, Slice of Life",
37749,Turning Mecard R,터닝메카드 R,,14447.0,17512,fall,2017.0,,Kids
37750,Turning Mecard W: Vandyne-ui Bimil,터닝메카드 W 반다인의 비밀,,14449.0,17274,fall,2017.0,Adventure,Kids
37752,Gonglyong Mecard,공룡메카드,,20110.0,16541,fall,2017.0,Adventure,Kids
37769,Aguu: Tensai Ningyou,悪偶 ‐天才人形‐,5.39,11939.0,7454,summer,2018.0,"Action, Drama, Supernatural",
37778,Pastel Life,ぱすてるらいふ,6.54,6595.0,7873,spring,2018.0,Slice of Life,
37779,Yakusoku no Neverland,約束のネバーランド,8.49,141.0,39,winter,2019.0,"Fantasy, Mystery, Sci-Fi, Suspense",Shounen
37780,Okojo to Yamane,オコジョとヤマネ,,17516.0,13913,summer,2018.0,"Comedy, Slice of Life",
37786,Yagate Kimi ni Naru,やがて君になる,7.89,817.0,692,fall,2018.0,"Drama, Girls Love",
37787,Space Bug,スペースバグ,5.98,9597.0,14258,summer,2018.0,Adventure,
37799,Tokyo Ghoul:re 2nd Season,東京喰種トーキョーグール：re 第2期,6.45,7125.0,194,fall,2018.0,"Action, Fantasy, Horror, Suspense",Seinen
37806,Gunjou no Magmell,群青のマグメル,6.11,8941.0,1484,spring,2019.0,"Action, Adventure, Fantasy",Shounen
37823,Conception,CONCEPTION（コンセプション）,4.59,13143.0,1781,fall,2018.0,"Action, Comedy, Fantasy, Romance",
37869,BanG Dream! 2nd Season,BanG Dream!（バンドリ！）第2期,7.58,1576.0,3330,winter,2019.0,,
37870,BanG Dream! 3rd Season,BanG Dream!（バンドリ！）第3期,8.0,635.0,3706,winter,2020.0,,
37890,Oshi ga Budoukan Ittekuretara Shinu,推しが武道館いってくれたら死ぬ,7.43,2154.0,3318,winter,2020.0,Comedy,Seinen
37893,Yami Shibai 6,闇芝居 6期,6.21,8435.0,4737,summer,2018.0,"Avant Garde, Horror, Supernatural",
37920,Ueno-san wa Bukiyou,上野さんは不器用,6.56,6441.0,1842,winter,2019.0,Comedy,Seinen
37924,Ani ni Tsukeru Kusuri wa Nai! 2,兄に付ける薬はない! 2,7.73,1165.0,3125,summer,2018.0,Comedy,
37926,Nakanohito Genome [Jikkyouchuu],ナカノヒトゲノム【実況中】,6.87,4822.0,1711,summer,2019.0,"Adventure, Drama, Mystery",
37940,Yatogame-chan Kansatsu Nikki,八十亀ちゃんかんさつにっき,6.26,8201.0,4016,spring,2019.0,"Comedy, Slice of Life",Shounen
37951,Ice Kuritarou,アイスくりたろう,,20696.0,19470,fall,2017.0,,Kids
37952,Shoumetsu Toshi,消滅都市,5.49,11660.0,2700,spring,2019.0,"Action, Adventure, Drama, Fantasy, Mystery",
37956,3D Kanojo: Real Girl 2nd Season,3D彼女 リアルガール第2シーズン,7.67,1313.0,1265,winter,2019.0,Romance,Shoujo
37958,Fukigen na Mononokean Tsuzuki,不機嫌なモノノケ庵 續,7.57,1628.0,3057,winter,2019.0,"Comedy, Supernatural",
37962,IDOLiSH7 Second Beat!,アイドリッシュセブン Second BEAT!,8.14,460.0,4014,spring,2020.0,Drama,
37964,Mayonaka no Occult Koumuin,真夜中のオカルト公務員,6.74,5456.0,2691,spring,2019.0,"Fantasy, Mystery",Shoujo
37965,Kaze ga Tsuyoku Fuiteiru,風が強く吹いている,8.38,204.0,807,fall,2018.0,"Drama, Sports",
37968,Kirakira Happy★Hirake! Cocotama,キラキラハッピー★ひらけ! ここたま,6.61,6173.0,12883,fall,2018.0,"Fantasy, Slice of Life",Kids
37972,Hoshiai no Sora,星合の空,7.59,1551.0,1200,fall,2019.0,"Drama, Sports",
37975,Piano no Mori (TV) 2nd Season,ピアノの森 第2シリーズ,7.44,2124.0,3113,winter,2019.0,Drama,Seinen
37976,Zombieland Saga,ゾンビランドサガ,7.5,1896.0,454,fall,2018.0,"Award Winning, Comedy, Supernatural",
37978,Kamisama Minarai: Himitsu no Cocotama - Minarai Cocotama-dou,かみさまみならい ヒミツのここたま 特别篇,,15966.0,16833,summer,2018.0,"Fantasy, Slice of Life",Kids
37979,Mahou Shoujo Tokushusen Asuka,魔法少女特殊戦あすか,6.33,7753.0,2328,winter,2019.0,"Action, Drama, Fantasy",Seinen
37982,Domestic na Kanojo,ドメスティックな彼女,6.65,5953.0,262,winter,2019.0,"Drama, Romance",Shounen
37988,Uchuu Senkan Tiramisù II,宇宙戦艦ティラミスⅡ（ツヴァイ）,6.52,6707.0,6461,fall,2018.0,"Comedy, Sci-Fi",
37989,Golden Kamuy 2nd Season,ゴールデンカムイ,8.24,330.0,1184,fall,2018.0,"Action, Adventure",Seinen
37990,Gurazeni Season 2,グラゼニ シーズン2,6.74,5465.0,8731,fall,2018.0,Sports,Seinen
37991,JoJo no Kimyou na Bouken Part 5: Ougon no Kaze,ジョジョの奇妙な冒険 黄金の風,8.58,100.0,152,fall,2018.0,"Action, Adventure, Supernatural",Shounen
37992,Jingai-san no Yome,人外さんの嫁,5.8,10474.0,3266,fall,2018.0,"Comedy, Fantasy, Romance",Josei
37993,Watashi ni Tenshi ga Maiorita!,私に天使が舞い降りた！,7.26,2972.0,1196,winter,2019.0,Comedy,
37998,Girly Air Force,ガーリー・エアフォース,6.14,8780.0,2428,winter,2019.0,"Action, Sci-Fi",
37999,Kaguya-sama wa Kokurasetai: Tensai-tachi no Renai Zunousen,かぐや様は告らせたい～天才たちの恋愛頭脳戦～,8.41,184.0,51,winter,2019.0,Comedy,Seinen
38000,Kimetsu no Yaiba,鬼滅の刃,8.46,152.0,6,spring,2019.0,"Action, Award Winning, Fantasy",Shounen
38003,Bungou Stray Dogs 3rd Season,文豪ストレイドッグス 第3期,8.21,364.0,335,spring,2019.0,"Action, Mystery, Supernatural",Seinen
38004,Strike Witches: 501 Butai Hasshin Shimasu!,ストライクウィッチーズ 501部隊発進しますっ！,6.61,6191.0,4959,spring,2019.0,"Comedy, Sci-Fi",Shounen
38005,Strike Witches: Road to Berlin,第501統合戦闘航空団 ストライクウィッチーズ ROAD to BERLIN,7.35,2495.0,4250,fall,2020.0,"Action, Sci-Fi, Ecchi",
38008,Hawaiian Conu,ハワイアン コヌ,,17733.0,18778,summer,2018.0,"Comedy, Slice of Life",
38009,Re:Stage! Dream Days♪,Re:ステージ! ドリームデイズ♪,6.68,5788.0,6165,summer,2019.0,Slice of Life,
38010,Kaeru Ouji to Imomushi Henry,カエル王子といもむしヘンリー,,18435.0,17435,summer,2018.0,"Comedy, Fantasy",
38016,Zannen na Ikimono Jiten,ざんねんないきもの事典,5.84,10244.0,15799,summer,2018.0,"Comedy, Slice of Life",
38020,Beatless Final Stage,BEATLESS Final Stage,6.79,5203.0,3717,summer,2018.0,"Action, Drama, Romance, Sci-Fi",
38062,Endro~!,えんどろ～！,6.9,4652.0,2495,winter,2019.0,"Fantasy, Slice of Life",
38074,Kkoma Bus Tayo 4,꼬마버스 타요 4,5.6,11292.0,18330,summer,2016.0,,Kids
38075,Titipo Titipo,띠띠뽀 띠띠뽀,,14282.0,18483,winter,2018.0,,Kids
38080,Kono Oto Tomare!,この音とまれ！,7.93,729.0,782,spring,2019.0,Drama,Shounen
38083,Ken En Ken: Aoki Kagayaki,軒轅剣・蒼き曜,6.02,9409.0,5208,fall,2018.0,"Action, Adventure, Fantasy",
38084,Fate/Grand Order: Zettai Majuu Sensen Babylonia,Fate/Grand Order -絶対魔獣戦線バビロニア-,7.94,716.0,878,fall,2019.0,"Action, Fantasy, Supernatural",
38089,"Okoshiyasu, Chitose-chan",おこしやす、ちとせちゃん,6.78,5259.0,7728,fall,2018.0,Slice of Life,Josei
38091,Hachigatsu no Cinderella Nine,八月のシンデレラナイン,6.12,8876.0,4256,spring,2019.0,Sports,
38098,Mix: Meisei Story,MIX MEISEI STORY,7.21,3192.0,4459,spring,2019.0,"Drama, Romance, Sports",Shounen
38101,5-toubun no Hanayome,五等分の花嫁,7.64,1389.0,166,winter,2019.0,"Comedy, Romance",Shounen
38128,Zhu Zhu Xia: Guang Ming Shou Wei Zhe,猪猪侠 光明守卫者,,15690.0,19091,spring,2016.0,Sci-Fi,Kids
38129,Zhu Zhu Xia: Meng Xiang Shou Wei Zhe,猪猪侠 梦想守卫者,,15697.0,18919,fall,2016.0,Sci-Fi,Kids
38131,Zhu Zhu Xia: Chao Xing Meng Chong,猪猪侠 超星萌宠,,15686.0,18863,spring,2017.0,Sci-Fi,Kids
38138,Zhu Zhu Xia: Jing Qiu Xiao Yingxiong,猪猪侠 竞球小英雄,,15692.0,18290,spring,2018.0,"Sci-Fi, Sports",Kids
38145,"Doukyonin wa Hiza, Tokidoki, Atama no Ue.",同居人はひざ、時々、頭のうえ。,7.72,1203.0,1233,winter,2019.0,Slice of Life,
38147,Hoshi no Shima no Nyanko,ほしの島のにゃんこ,,20547.0,16116,fall,2018.0,"Adventure, Slice of Life",
38150,Namu Amida Butsu! Rendai Utena,なむあみだ仏っ! -蓮台 UTENA-,6.06,9220.0,5495,spring,2019.0,Fantasy,
38157,Circlet Princess,CIRCLET PRINCESS（サークレット・プリンセス）,5.96,9697.0,5162,winter,2019.0,"Sci-Fi, Sports",
38161,Kabukichou Sherlock,歌舞伎町シャーロック,6.89,4717.0,2380,fall,2019.0,"Comedy, Drama, Mystery",
38162,Rinshi!! Ekoda-chan,臨死!!江古田ちゃん,5.52,11565.0,6212,winter,2019.0,Comedy,Seinen
38166,Malta no Bouken Season 3,マルタの冒険　シーズン3,,16687.0,21007,spring,2017.0,Adventure,Kids
38186,Bokutachi wa Benkyou ga Dekinai,ぼくたちは勉強ができない,7.27,2890.0,515,spring,2019.0,"Comedy, Romance",Shounen
38199,Bermuda Triangle: Colorful Pastrale,バミューダトライアングル ～カラフル・パストラーレ～,5.49,11626.0,6844,winter,2019.0,Fantasy,
38203,The iDOLM@STER SideM: Wake Atte Mini!,アイドルマスター SideM 理由あってMini!,6.25,8207.0,9366,fall,2018.0,Comedy,
38226,Choukadou Girl ⅙,超可動ガール1/6,5.98,9610.0,5104,spring,2019.0,"Comedy, Romance, Sci-Fi",Seinen
38235,Inazuma Eleven: Orion no Kokuin,イナズマイレブン オリオンの刻印,6.88,4787.0,4182,fall,2018.0,Sports,
38251,"Sono Toki, Kanojo wa.",その時、カノジョは。,5.66,11022.0,5469,fall,2018.0,"Drama, Romance",
38254,Hashiri Tsuzukete Yokatta tte.,走り続けてよかったって。,6.37,7574.0,5934,fall,2018.0,"Drama, Slice of Life",
38256,Magia Record: Mahou Shoujo Madoka☆Magica Gaiden,マギアレコード 魔法少女まどか☆マギカ外伝 (TV),6.81,5115.0,1466,winter,2020.0,"Drama, Fantasy, Suspense",
38262,Pingu in the City (2018),ピングー in ザ・シティ,6.4,7393.0,6471,fall,2018.0,Comedy,Kids
38268,Hangyakusei Million Arthur 2nd Season,叛逆性ミリオンアーサー 第2シーズン,6.29,8007.0,4955,spring,2019.0,"Action, Adventure, Fantasy",
38276,Houkago Saikoro Club,放課後さいころ倶楽部,6.71,5622.0,3148,fall,2019.0,Comedy,Shounen
38284,Devidol!,でびどる！,5.41,11900.0,10056,fall,2018.0,Comedy,
38295,Joshikausei,女子かう生,5.83,10283.0,2705,spring,2019.0,"Comedy, Slice of Life",
38297,"Maou-sama, Retry!",魔王様、リトライ！,6.55,6507.0,989,summer,2019.0,"Action, Adventure, Fantasy",
38301,Kouya no Kotobuki Hikoutai,荒野のコトブキ飛行隊,6.83,4987.0,3880,winter,2019.0,"Action, Adventure",
38302,Boku no Tonari ni Ankoku Hakaishin ga Imasu.,ぼくのとなりに暗黒破壊神がいます。,6.62,6131.0,2898,winter,2020.0,Comedy,Josei
38328,Azur Lane,アズールレーン THE ANIMATION,6.29,7990.0,1392,fall,2019.0,"Action, Sci-Fi",
38331,Stand My Heroes: Piece of Truth,スタンドマイヒーローズ PIECE OF TRUTH,5.78,10533.0,4293,fall,2019.0,"Mystery, Romance",Josei
38337,Gochuumon wa Usagi desu ka? Bloom,ご注文はうさぎですか? BLOOM,7.92,747.0,2761,fall,2020.0,Slice of Life,
38365,Aigan Kaijuu,愛玩怪獣,,18433.0,16165,fall,2018.0,"Action, Comedy, Fantasy, Sci-Fi",
38390,Chuubyou Gekihatsu Boy,厨病激発ボーイ,6.76,5375.0,3264,fall,2019.0,Comedy,
38397,Nande Koko ni Sensei ga!?,なんでここに先生が!?,6.5,6816.0,672,spring,2019.0,"Comedy, Ecchi",Seinen
38408,Boku no Hero Academia 4th Season,僕のヒーローアカデミア,7.87,852.0,54,fall,2019.0,Action,Shounen
38427,Daifuku-kun@Kin Tele,大福くん＠きんてれ,,19428.0,18938,fall,2018.0,Comedy,
38449,Choujigen Kakumei Anime: Dimension High School,超次元革命アニメ Dimensionハイスクール,5.12,12574.0,6631,winter,2019.0,Fantasy,
38451,Reizouko no Tsukenosuke!,れいぞうこのつけのすけ！,,18030.0,18199,fall,2018.0,Comedy,Kids
38472,Isekai Quartet,異世界かるてっと,7.38,2357.0,614,spring,2019.0,"Comedy, Fantasy",
38476,Heya Camp△,へやキャン△,7.35,2471.0,2136,winter,2020.0,Slice of Life,
38480,Toaru Kagaku no Accelerator,とある科学の一方通行〈アクセラレータ〉,7.21,3200.0,1028,summer,2019.0,"Action, Fantasy, Sci-Fi",
38481,Toaru Kagaku no Railgun T,とある科学の超電磁砲[レールガン]T,8.15,441.0,1055,winter,2020.0,"Action, Fantasy, Sci-Fi",
38483,Ore wo Suki nano wa Omae dake ka yo,俺を好きなのはお前だけかよ,7.3,2705.0,494,fall,2019.0,"Comedy, Romance",
38524,Shingeki no Kyojin Season 3 Part 2,進撃の巨人 Season3 Part.2,9.05,5.0,21,spring,2019.0,"Action, Drama, Suspense",Shounen
38526,Chuldong! Super Wings 2,출동! 슈퍼윙스2,5.77,10610.0,17863,spring,2017.0,Adventure,Kids
38529,Rifle Is Beautiful,ライフル・イズ・ビューティフル,6.2,8490.0,3626,fall,2019.0,"Comedy, Sports",Seinen
38537,Huoli Shaonian Wang zhi You Quan Yingxiong,火力少年王之悠拳英雄,,18060.0,20023,,,,Kids
38544,Egao no Daika,エガオノダイカ,6.03,9361.0,3688,winter,2019.0,"Action, Drama, Fantasy, Sci-Fi",
38549,TV Yarou Nanaana,テレビ野郎 ナナーナ,6.35,7662.0,11464,spring,2018.0,"Adventure, Comedy",
38555,Otome Game no Hametsu Flag shika Nai Akuyaku Reijou ni Tensei shiteshimatta...,乙女ゲームの破滅フラグしかない悪役令嬢に転生してしまった…,7.46,2038.0,498,spring,2020.0,"Comedy, Fantasy, Romance",Shoujo
38560,Sylvanian Families: Mini Story 2nd Season,シルバニアファミリー ミニストーリー 第2期,,14027.0,18908,fall,2018.0,Slice of Life,Kids
38572,Assassins Pride,アサシンズプライド,5.92,9907.0,691,fall,2019.0,Fantasy,
38573,Tsuujou Kougeki ga Zentai Kougeki de Ni-kai Kougeki no Okaasan wa Suki desu ka?,通常攻撃が全体攻撃で二回攻撃のお母さんは好きですか？,5.55,11469.0,865,summer,2019.0,"Adventure, Comedy, Fantasy, Ecchi",
38578,Star☆Twinkle Precure,スター☆トゥインクルプリキュア,7.53,1765.0,5914,winter,2019.0,"Action, Fantasy",
38610,Tejina-senpai,手品先輩,6.4,7405.0,892,summer,2019.0,"Comedy, Ecchi",Seinen
38611,Power Battle Watch Car,파워배틀 와치카,5.84,10277.0,17868,spring,2016.0,,Kids
38612,Power Battle Watch Car Season 2,파워배틀 와치카 시즌 2,5.87,10144.0,18787,summer,2016.0,,Kids
38619,Joshikousei no Mudazukai,女子高生の無駄づかい,7.7,1239.0,1812,summer,2019.0,Comedy,
38631,Kkoma Bus Tayo 5,꼬마버스 타요 5,,16160.0,18299,summer,2018.0,,Kids
38656,Darwin's Game,ダーウィンズゲーム,7.22,3136.0,392,winter,2020.0,"Action, Mystery, Sci-Fi, Suspense",Shounen
38659,Shinchou Yuusha: Kono Yuusha ga Ore Tueee Kuse ni Shinchou Sugiru,慎重勇者 ～この勇者が俺TUEEEくせに慎重すぎる～,7.48,1949.0,346,fall,2019.0,"Action, Adventure, Comedy, Fantasy",
38668,Dorohedoro,ドロヘドロ,8.05,577.0,398,winter,2020.0,"Action, Comedy, Fantasy, Horror",Seinen
38669,Tsukiuta. The Animation 2,ツキウタ. THE ANIMATION 2,6.63,6070.0,7122,fall,2020.0,,
38670,Actors: Songs Connection,ACTORS -Songs Connection-,6.3,7911.0,5073,fall,2019.0,,
38671,Enen no Shouboutai,炎炎ノ消防隊,7.71,1219.0,99,summer,2019.0,"Action, Fantasy, Sci-Fi",Shounen
38673,Mini Toji,みにとじ,6.11,8964.0,7805,winter,2019.0,"Action, Comedy, Fantasy",
38680,Fruits Basket 1st Season,フルーツバスケット,8.21,366.0,213,spring,2019.0,"Drama, Romance, Supernatural",Shoujo
38691,Dr. Stone,ドクターストーン,8.27,299.0,50,summer,2019.0,"Adventure, Comedy, Sci-Fi",Shounen
38707,RobiHachi,ロビハチ,6.54,6599.0,3884,spring,2019.0,"Adventure, Comedy, Sci-Fi",
38731,Diamond no Ace: Act II,ダイヤのA[エース] actII,8.27,298.0,2250,spring,2019.0,Sports,Shounen
38753,Araburu Kisetsu no Otome-domo yo.,荒ぶる季節の乙女どもよ。,7.31,2664.0,700,summer,2019.0,"Drama, Romance",Shounen
38759,Sewayaki Kitsune no Senko-san,世話やきキツネの仙狐さん,7.32,2639.0,672,spring,2019.0,"Slice of Life, Supernatural",
38767,Cinderella Girls Gekijou: Climax Season,シンデレラガールズ劇場 CLIMAX SEASON,6.46,7049.0,8745,spring,2019.0,"Comedy, Slice of Life",
38778,Midara na Ao-chan wa Benkyou ga Dekinai,淫らな青ちゃんは勉強ができない,6.71,5598.0,890,spring,2019.0,"Comedy, Romance, Ecchi",Shounen
38787,Senryuu Shoujo,川柳少女,7.37,2382.0,1299,spring,2019.0,Comedy,Shounen
38790,Itai no wa Iya nanode Bougyoryoku ni Kyokufuri Shitai to Omoimasu.,痛いのは嫌なので防御力に極振りしたいと思います。,7.52,1811.0,417,winter,2020.0,"Action, Adventure, Comedy, Fantasy",
38804,Kiratto Pri☆chan Season 2,キラッとプリ☆チャン シーズン2,7.42,2175.0,9832,spring,2019.0,"Comedy, Slice of Life",
38814,Nobunaga-sensei no Osanazuma,ノブナガ先生の幼な妻,5.31,12161.0,2344,spring,2019.0,"Comedy, Romance, Ecchi",
38830,"Hachi-nan tte, Sore wa Nai deshou!",八男って、それはないでしょう！,6.27,8109.0,1009,spring,2020.0,"Action, Fantasy",
