mal_id,title_default,title_japanese,score,rank,popularity,season,year,demographics,genres
3271,Bakutou Sengen Daigunder,爆闘宣言ダイガンダー,6.79,5205.0,9480,spring,2002.0,"Adventure, Sci-Fi",
3290,Vampiyan Kids,バンパイヤン・キッズ,5.89,10043.0,13221,fall,2001.0,"Comedy, Fantasy",Kids
3355,Fortune Dogs,ふぉうちゅんドッグす,6.41,7343.0,12035,summer,2002.0,Adventure,
3519,Garakuta-doori no Stain,ガラクタ通りのステイン,6.39,7433.0,11118,winter,2003.0,"Award Winning, Comedy",
3561,Dennou Boukenki Webdiver,電脳冒険記ウェブダイバー,6.95,4445.0,10035,spring,2001.0,"Action, Adventure, Sci-Fi",
3637,Bouken Yuuki Pluster World,冒険遊記プラスターワールド,6.19,8540.0,13177,spring,2003.0,"Action, Adventure, Sci-Fi",
3638,Kaiketsu Zorori,かいけつゾロリ,7.06,3938.0,9319,winter,2004.0,"Adventure, Comedy",
3736,Parappa the Rapper,パラッパラッパー,6.27,8130.0,8675,spring,2001.0,"Comedy, Fantasy",
3768,Play Ball,プレイボール,5.92,9893.0,12629,summer,2005.0,Sports,Shounen
3772,Saiko Robot Kombock,로보짱 큐빅스,5.37,12019.0,8650,summer,2001.0,Sci-Fi,
3776,Go! Go! Itsutsugo Land,ゴーゴー五つ子ら・ん・ど,6.39,7435.0,13584,spring,2001.0,,
4049,Mafukiden: Pandarian,魔豆奇伝パンダリアン,6.25,8225.0,13301,winter,2005.0,"Adventure, Comedy, Fantasy",Kids
4068,Shin Megami Tensei Devil Children: Light & Dark,真･女神転生Ｄチルドレン ライト＆ダーク,6.41,7321.0,10705,fall,2002.0,"Action, Adventure, Fantasy, Sci-Fi, Supernatural",Kids
4104,Mini Moni the TV,ミニモニ. じゃてーびぃ,5.24,12331.0,14649,summer,2003.0,Comedy,
4314,Nanami-chan 2nd Series,ななみちゃん 第2シリーズ,6.16,8672.0,15009,summer,2005.0,Comedy,Kids
4416,Yuusha-Ou GaoGaiGar Final Grand Glorious Gathering,勇者王ガオガイガーFINAL Grand Glorious Gathering,7.4,2264.0,9008,spring,2005.0,"Action, Sci-Fi",
4586,Daisuki! BuBu ChaCha,だいすき! ぶぶチャチャ,7.02,4125.0,11495,spring,2001.0,,Kids
4667,B-Legend! Battle B-Daman Fire Spirits!,B-伝説(ビーレジェンド)! バトルビーダマン 炎魂(ファイヤースピリッツ!),6.39,7425.0,8339,winter,2005.0,"Adventure, Fantasy",Kids
4801,Suhoyojeong Michel,수호요정 미셸,6.17,8658.0,14118,summer,2003.0,"Adventure, Fantasy",Kids
4940,Sabaku no Kaizoku! Captain Kuppa,砂漠の海賊！ キャプテンクッパ,,18171.0,14668,summer,2001.0,"Action, Adventure",
5018,Piroppo,ピロッポ,5.29,12201.0,14363,fall,2001.0,Comedy,
5071,Croket!,コロッケ！,6.87,4797.0,12248,spring,2003.0,"Action, Adventure, Comedy, Fantasy",Kids
5129,Jikuu Boukenki Zentrix,時空冒険記　ゼントリックス,6.22,8387.0,12980,spring,2003.0,"Adventure, Sci-Fi",
5200,Offside (TV),オフサイド,7.1,3784.0,8983,spring,2001.0,"Drama, Sports",
5343,Monkey Punch: Manga Katsudou Daishashin,モンキー・パンチ　漫画活動大写真,6.76,5338.0,10540,summer,2004.0,"Action, Adventure, Comedy, Ecchi",Seinen
5473,Tsuri Baka Nisshi,釣りバカ日誌,,14397.0,14250,fall,2002.0,"Comedy, Slice of Life",
5474,Yobarete Tobidete Akubi-chan,よばれてとびでて！アクビちゃん,5.68,10968.0,13376,winter,2002.0,"Comedy, Fantasy",Kids
5967,Kinnikuman II Sei: Ultimate Muscle,キン肉マンII世 ULTIMATE MUSCLE,6.94,4461.0,7045,spring,2004.0,"Comedy, Sci-Fi, Sports",
6523,Porong Porong Pororo,뽀롱뽀롱 뽀로로,5.93,9875.0,13549,fall,2003.0,,Kids
6625,Nono-chan,ののちゃん,6.1,8988.0,12881,summer,2001.0,"Comedy, Slice of Life",
7048,Crush Gear Nitro,クラッシュギアNitro,6.1,9021.0,11353,winter,2003.0,Sports,
7109,Gyouten Ningen Batsealer,仰天人間バトシーラー,6.42,7278.0,14870,spring,2001.0,"Action, Adventure, Fantasy",
7452,Mini Moni Yaru no da Pyon!,ミニモニ。やるのだぴょん,5.0,12737.0,15612,summer,2001.0,Comedy,
7525,Kick Off 2002,キックオフ２００２,,16103.0,15449,winter,2002.0,Sports,
7750,DigiGirl Pop!: Strawberry & Pop Mix Flavor,デジガールPOP! 〜STRAWBERRY＆POP MIX FLAVOR〜,,16936.0,14891,winter,2003.0,"Comedy, Sci-Fi",
7751,Midnight Horror School,ミッドナイトホラースクール,6.22,8369.0,13996,fall,2003.0,Comedy,
7955,The Marshmallow Times,マシュマロ通信,6.61,6176.0,12123,spring,2004.0,Slice of Life,
7960,Pachislo Kizoku Gin,パチスロ貴族 銀,5.91,9957.0,12656,spring,2001.0,"Action, Suspense",
8956,Denkou Chou Tokkyuu Hikarian,電光超特急ヒカリアン,6.27,8102.0,13497,spring,2002.0,"Action, Adventure",Kids
9433,A-jang.com,아장닷컴,5.63,11164.0,14500,fall,2001.0,Fantasy,
9948,Wo Wei Ge Kuang,我为歌狂,,14708.0,17140,,,,
10237,Ki-Fighter Taerang,キ・ファイター テラン,,16099.0,18485,summer,2002.0,Adventure,Kids
10239,Mayutoro The Toons,まゆとろ THE TOONS,,16787.0,18535,fall,2003.0,"Comedy, Fantasy",Kids
10242,Ton-Ton Atta to Niigata no Mukashibanashi,トントンあったと にいがたの昔ばなし,,14333.0,19202,fall,2004.0,Comedy,
10360,Kinniku Banzuke: Kongou-kun no Daibouken!,筋肉番付 金剛くんの大冒険!,4.98,12760.0,14330,summer,2001.0,Sports,Shounen
10987,Zettai Zetsumei Dangerous Jiisan (2004),絶体絶命でんぢゃらすじーさん,,15559.0,15036,spring,2004.0,Comedy,Kids
10989,Stray Sheep: Poe no Chicchana Daibouken,ストレイシープ ポーのちっちゃな大冒険,5.96,9680.0,16397,fall,2001.0,Comedy,Kids
11497,Sore Ike! Zukkoke Sannin-gumi,それいけ! ズッコケ三人組,,13922.0,17272,spring,2004.0,Comedy,Kids
11525,Mamimume★Mogacho,まみむめ★もがちょ,,16701.0,16182,summer,2001.0,,Kids
12359,Pecola,ペコラ,5.75,10694.0,15240,fall,2002.0,,Kids
12613,Morizo to Kikkoro,モリゾーとキッコロ,,19699.0,18986,spring,2004.0,,Kids
12809,Wonder Bebil-kun,ワンダーベビルくん,,14723.0,14879,spring,2003.0,"Comedy, Fantasy",
15479,Hey Yo Yorang,꼬마여우 요랑,,20431.0,15984,summer,2003.0,"Adventure, Comedy, Fantasy",Kids
16027,Greek Roman Sinhwa: Olympus Guardian,그리스 로마 신화-올림포스 가디언,6.08,9105.0,12479,winter,2003.0,"Adventure, Fantasy",
17487,Tantei Shounen Kageman,探偵少年カゲマン,,14119.0,17544,spring,2001.0,"Comedy, Mystery",
18005,Forza! Hidemaru,フォルツァ！ひでまる,,19899.0,15979,spring,2002.0,Sports,
18447,Spheres,스피어즈,6.06,9235.0,14292,winter,2003.0,"Action, Fantasy",
20123,Kappamaki,かっぱまき,,16004.0,17571,spring,2003.0,"Comedy, Slice of Life",
23313,Zettai Zetsumei Dangerous Jiisan,絶体絶命でんぢゃらすじーさん,,15558.0,16542,fall,2003.0,Comedy,Kids
25609,Genki Genki Non-tan,げんき げんき ノンタン,,17431.0,18145,fall,2002.0,,Kids
25611,Genki Genki Non-tan (2004),げんき げんき ノンタン,,20040.0,18494,spring,2004.0,,Kids
25809,Oretachi Ijiwaru Kei,おれたちイジワルケイ,,17567.0,17740,winter,2005.0,Comedy,
27551,Deko Boko Friends,でこぼこフレンズ,,19503.0,18352,,,Comedy,Kids
27721,Kasumin,カスミン (第1シリーズ),6.3,7940.0,11867,fall,2001.0,Fantasy,Kids
27723,Kasumin 2nd Season,カスミン (第2シリーズ),,18593.0,14575,fall,2002.0,Fantasy,Kids
29740,Notteke Explet's,のってけエクスプレッツ,,20014.0,19758,spring,2004.0,,Kids
29836,Akuei to Gacchinpo,アークエとガッチンポー,,18455.0,16861,fall,2004.0,Comedy,Kids
29843,Akuei to Gacchinpo: Tenkomori,アークエとガッチンポー てんこもり,,18458.0,17618,winter,2005.0,Comedy,Kids
30138,Rusuden Hour: Sodan Brothers,留守電アワー SODANブラザーズ,,20711.0,19033,spring,2005.0,Comedy,
30409,Nepos Napos,ネポス・ナポス,,17334.0,19308,winter,2005.0,Fantasy,Kids
31054,"Letchu, Getchu, Saru Getchu",レッチュ ゲッチュ サルゲッチュ,5.5,11603.0,15902,spring,2002.0,Comedy,
31696,Witch Village Story,ウィッチ ヴィレッジ ストーリー,,14660.0,19176,winter,2005.0,Slice of Life,
32580,Uniminipet,유니미니펫,,14522.0,17171,summer,2001.0,"Adventure, Fantasy",
32590,Taeng-gu & Ulasyong,탱구와 울라숑,,14048.0,18234,spring,2001.0,"Action, Comedy",
34249,Aqua Kids,아쿠아 키즈,,18547.0,17606,spring,2004.0,Adventure,Kids
34490,Sushi Azarashi,すしあざらし,,14010.0,17430,winter,2001.0,Comedy,
35817,Curry no Kuni no Coburoux,カレーの国のコバ～ル,,16757.0,18375,fall,2004.0,Comedy,
36735,Capsule Samurai,カプセル侍,,19060.0,20500,,,Comedy,
37798,Chaechaepong Kimchi Pong,채채퐁 김치퐁,,19084.0,18577,summer,2002.0,"Adventure, Fantasy",Kids
39936,Nezha Chuanqi,哪吒传奇,6.8,5174.0,15240,summer,2003.0,Adventure,
40299,Gokiburi-chan,ゴキブリちゃん,,20094.0,19596,spring,2005.0,,Kids
43319,Di Di Zi Zhou Ji,迪迪仔周記,,19519.0,24143,,,,Kids
43320,Di Di Zi Zhou Ji II,迪迪仔周記II,,19520.0,24144,,,,Kids
43857,Xiao Caomao,小草帽,,14859.0,25693,,,,Kids
43863,Bravo Dong Dong,BRAVO东东,,18950.0,24492,,,Comedy,Kids
48206,Mujigae Yojeong Tongtong,무지개 요정 통통,,19741.0,22930,winter,2001.0,"Adventure, Fantasy",Kids
48215,Haerowa Toremi,해로와 토레미,,17615.0,22742,winter,2002.0,"Adventure, Fantasy",Kids
48260,Taikong Xiha Zu,스페이스 힙합덕,,14066.0,21242,winter,2003.0,"Adventure, Comedy, Fantasy, Sci-Fi",
48287,Allegseuui Moheom,알렉스의 모험,,18476.0,21197,spring,2004.0,Fantasy,Kids
51085,Kyojin no Hoshi: Tokubetsu-hen - Hanagata Mitsuru,巨人の星【特別篇】猛虎 花形満,,18974.0,20280,fall,2002.0,"Drama, Sports",
56462,Umeyon Ekisu,梅四エッキス,,14515.0,24691,spring,2003.0,Comedy,
57114,Geomjeong-gomusin 2nd Season,검정 고무신 2기,,20054.0,25093,winter,2001.0,Comedy,Kids
57115,Geomjeong-gomusin 3rd Season,검정 고무신 3기,,20055.0,25309,summer,2004.0,Comedy,Kids
356,Fate/stay night,Fate/stay night,7.27,2898.0,176,winter,2006.0,"Action, Fantasy, Romance, Supernatural",
576,Magikano,マジカノ,6.31,7871.0,3822,winter,2006.0,"Comedy, Fantasy, Romance",Shounen
577,Kagi Hime Monogatari: Eikyuu Alice Rondo,鍵姫物語 永久アリス輪舞曲,6.12,8883.0,6784,winter,2006.0,Fantasy,
586,Ayakashi: Japanese Classic Horror,怪～ayakashi～ Japanese Classic Horror,7.37,2386.0,2486,winter,2006.0,"Horror, Mystery, Supernatural",
587,Hanbun no Tsuki ga Noboru Sora,半分の月がのぼる空,7.45,2087.0,2101,winter,2006.0,"Drama, Romance",
590,Kage kara Mamoru!,陰からマモル！,6.56,6433.0,4361,winter,2006.0,"Comedy, Romance",
607,Otogi Juushi Akazukin,おとぎ銃士 赤ずきん,6.92,4594.0,7130,summer,2006.0,"Adventure, Comedy, Fantasy",
667,Kashimashi: Girl Meets Girl,かしまし〜ガール・ミーツ・ガール〜,6.61,6171.0,3135,winter,2006.0,"Comedy, Drama, Girls Love",
671,Lemon Angel Project,レモン エンジェル プロジェクト,6.51,6753.0,6824,winter,2006.0,Drama,
710,Rec,レック,7.27,2872.0,1944,winter,2006.0,"Comedy, Romance",Seinen
750,Binchou-tan,びんちょうタン,7.04,4037.0,5633,winter,2006.0,Slice of Life,Shounen
771,Ginyuu Mokushiroku Meine Liebe Wieder,吟遊黙示録マイネリーベ ヴィーダー,6.63,6057.0,7155,winter,2006.0,"Drama, Fantasy",
789,Shinigami no Ballad.,しにがみのバラッド。,6.89,4690.0,3281,spring,2006.0,"Drama, Fantasy, Supernatural",
790,Ergo Proxy,エルゴプラクシー,7.9,794.0,327,winter,2006.0,"Mystery, Sci-Fi, Suspense",
798,Yomigaeru Sora: Rescue Wings,よみがえる空 -Rescue Wings-,7.34,2514.0,5481,winter,2006.0,Drama,
817,Tactical Roar,タクティカルロア,6.39,7464.0,6331,winter,2006.0,"Comedy, Romance, Sci-Fi",
845,Kiba,牙-KIBA-,7.28,2836.0,2463,spring,2006.0,"Action, Adventure, Fantasy",
846,School Rumble Ni Gakki,スクールランブル 二学期,7.98,666.0,1463,spring,2006.0,"Comedy, Romance",Shounen
849,Suzumiya Haruhi no Yuuutsu,涼宮ハルヒの憂鬱,7.82,942.0,186,spring,2006.0,"Award Winning, Comedy, Mystery, Sci-Fi",
850,Gakuen Heaven,学園ヘヴン,6.45,7079.0,2687,spring,2006.0,"Boys Love, Comedy, Drama",
853,Ouran Koukou Host Club,桜蘭高校ホスト部,8.15,449.0,130,spring,2006.0,"Comedy, Romance",Shoujo
854,Soul Link,Soul Link,6.09,9063.0,4683,spring,2006.0,"Action, Adventure, Comedy, Romance, Sci-Fi",
855,Strawberry Panic,ストロベリー・パニック,7.27,2879.0,1611,spring,2006.0,"Drama, Girls Love",
856,Utawarerumono,うたわれるもの,7.61,1514.0,1401,spring,2006.0,"Action, Drama, Fantasy, Sci-Fi",
857,Air Gear,エア・ギア,7.48,1956.0,681,spring,2006.0,"Comedy, Sports, Ecchi",Shounen
859,Digimon Savers,デジモンセイバーズ,6.96,4386.0,2283,spring,2006.0,"Adventure, Comedy, Drama, Fantasy",
860,Makai Senki Disgaea,魔界戦記ディスガイア,6.7,5667.0,3398,spring,2006.0,"Action, Comedy, Fantasy",
861,xxxHOLiC,×××HOLiC（ホリック）,7.98,669.0,754,spring,2006.0,"Comedy, Drama, Mystery, Supernatural",Seinen
863,Joshikousei: Girl's High,女子高生 GIRL'S HIGH,6.57,6401.0,3694,spring,2006.0,"Comedy, Ecchi",Seinen
873,.hack//Roots,.hack//Roots,6.86,4861.0,2550,spring,2006.0,"Adventure, Drama, Fantasy",
877,Nana,NANA [ナナ],8.55,114.0,301,spring,2006.0,"Drama, Romance",Shoujo
878,Zegapain,ゼーガペイン,7.28,2802.0,3837,spring,2006.0,"Action, Romance, Sci-Fi",
879,Simoun,シムーン,7.41,2227.0,3439,spring,2006.0,"Drama, Fantasy, Girls Love",
880,Aa! Megami-sama! Sorezore no Tsubasa,ああっ女神さまっ　それぞれの翼,7.54,1738.0,2718,spring,2006.0,"Comedy, Romance, Supernatural",Seinen
886,Amaenaide yo!! Katsu!!,あまえないでよっ!! 喝!!,6.63,6042.0,3120,winter,2006.0,"Comedy, Romance, Supernatural, Ecchi",Seinen
889,Black Lagoon,BLACK LAGOON,8.03,600.0,156,spring,2006.0,Action,Seinen
907,Princess Princess,プリンセス・プリンセス,6.97,4354.0,2762,spring,2006.0,Comedy,Shoujo
910,Himawari!,ひまわりっ!,6.3,7933.0,4513,spring,2006.0,"Adventure, Comedy",
916,Tokkou,TOKKÔ[特公],6.52,6680.0,3311,spring,2006.0,"Action, Horror, Mystery, Supernatural",Seinen
918,Gintama,銀魂,8.94,16.0,143,spring,2006.0,"Action, Comedy, Sci-Fi",Shounen
919,Ray The Animation,RAY THE ANIMATION,6.6,6256.0,5508,spring,2006.0,"Drama, Romance, Sci-Fi",
934,Higurashi no Naku Koro ni,ひぐらしのなく頃に,7.87,858.0,237,spring,2006.0,"Horror, Mystery, Supernatural, Suspense",
935,Witchblade,ウィッチブレイド,7.2,3256.0,1895,spring,2006.0,"Action, Drama, Sci-Fi",
940,Inukami!,いぬかみっ!,7.22,3156.0,2658,spring,2006.0,"Comedy, Romance, Supernatural, Ecchi",
941,Renkin San-kyuu Magical? Pokaan,錬金3級 まじかる?ぽか〜ん,6.94,4488.0,3901,spring,2006.0,"Comedy, Ecchi",
942,Nishi no Yoki Majo: Astraea Testament,西の善き魔女 Astraea Testament,6.67,5836.0,4964,spring,2006.0,"Comedy, Drama, Fantasy, Mystery, Romance",
943,Yume Tsukai,夢使い,6.42,7292.0,6638,spring,2006.0,"Drama, Fantasy, Slice of Life",
944,The Third: Aoi Hitomi no Shoujo,ザ・サード 蒼い瞳の少女,7.3,2709.0,4740,spring,2006.0,"Action, Adventure, Sci-Fi",
953,Juu Ou Sei,獣王星,7.19,3297.0,2568,spring,2006.0,"Action, Adventure, Drama, Mystery, Sci-Fi",Shoujo
957,Saiunkoku Monogatari,彩雲国物語,7.88,841.0,2159,spring,2006.0,"Adventure, Fantasy, Romance",Shoujo
962,Aria the Natural,ARIA The NATURAL,8.16,432.0,2440,spring,2006.0,"Fantasy, Sci-Fi, Slice of Life",Shounen
965,Yoshinaga-sanchi no Gargoyle,吉永さん家のガーゴイル,6.76,5362.0,8269,spring,2006.0,"Comedy, Fantasy, Slice of Life",
968,Kakutou Bijin Wulong: Rebirth,格闘美神 武龍[ウーロン] REBIRTH,6.83,4983.0,9142,spring,2006.0,"Action, Comedy",Seinen
969,Tsubasa Chronicle 2nd Season,ツバサ・クロニクル 第2シリーズ,7.57,1606.0,1888,spring,2006.0,"Action, Adventure, Drama, Fantasy, Romance",Shounen
973,Glass no Kantai: La Legende du Vent de l'Univers,ガラスの艦隊～La legende du vent de l'univers～,6.51,6740.0,5920,spring,2006.0,"Adventure, Sci-Fi",
990,Kamisama Kazoku,神様家族,7.09,3797.0,3246,spring,2006.0,"Comedy, Drama, Fantasy, Romance",
1013,Le Chevalier D'Eon,シュヴァリエ Le Chevalier D'Eon,7.17,3407.0,2873,summer,2006.0,"Mystery, Supernatural",
1067,Kishin Houkou Demonbane (TV),機神咆吼デモンベイン,6.52,6676.0,3750,spring,2006.0,"Action, Drama, Fantasy, Romance, Sci-Fi",
1070,Love Get Chu,ラブゲッCHU ～ミラクル声優白書～,6.48,6920.0,6837,spring,2006.0,"Comedy, Romance",
1142,Hachimitsu to Clover II,ハチミツとクローバー II,8.19,387.0,2030,summer,2006.0,"Drama, Romance",Josei
1194,Coyote Ragtime Show,コヨーテ ラグタイムショー,6.62,6128.0,4815,summer,2006.0,"Action, Adventure, Comedy, Sci-Fi",
1195,Zero no Tsukaima,ゼロの使い魔,7.21,3201.0,228,summer,2006.0,"Action, Adventure, Comedy, Fantasy, Romance, Ecchi",
1198,Tsuyokiss,つよきす,6.53,6606.0,4930,summer,2006.0,"Comedy, Romance",
1200,Gun-dou Musashi,GUN道 MUSASHI,5.43,11824.0,6959,spring,2006.0,"Adventure, Fantasy",
1210,NHK ni Youkoso!,N・H・Kにようこそ！,8.31,257.0,266,summer,2006.0,"Comedy, Drama, Romance, Suspense",
1212,Oban Star-Racers,オーバン・スターレーサーズ,7.5,1893.0,3108,fall,2006.0,"Action, Adventure, Sci-Fi",
1214,Binbou Shimai Monogatari,貧乏姉妹物語,6.84,4945.0,4728,summer,2006.0,Slice of Life,Seinen
1218,Tonagura!,となグラ！,6.67,5853.0,3181,summer,2006.0,"Comedy, Romance, Ecchi",Shounen
1219,Chocotto Sister,ちょこッとSister,6.74,5459.0,4776,summer,2006.0,"Comedy, Drama, Romance, Ecchi",
1221,Demashita! Powerpuff Girls Z,出ましたっ！パワパフガールズZ,6.47,6990.0,3789,summer,2006.0,"Action, Comedy, Sci-Fi",
1222,Bokura ga Ita,僕等がいた,7.24,3051.0,1070,summer,2006.0,"Drama, Romance",Shoujo
1230,Innocent Venus,イノセント・ヴィーナス,6.77,5317.0,4328,summer,2006.0,"Action, Adventure, Drama, Sci-Fi",
1243,Night Head Genesis,NIGHT HEAD GENESIS (ナイト ヘッド ジェネシス),6.71,5646.0,4050,summer,2006.0,"Drama, Mystery, Sci-Fi, Supernatural",
1247,Project BLUE Chikyuu SOS,Project BLUE 地球SOS,6.59,6319.0,9294,summer,2006.0,"Adventure, Comedy, Sci-Fi",
1292,Afro Samurai,アフロサムライ,7.37,2389.0,629,spring,2007.0,"Action, Adventure",
1410,IGPX: Immortal Grand Prix (2005) 2nd Season,IGPX -Immortal Grand Prix-,7.25,3010.0,6140,spring,2006.0,"Action, Sci-Fi",
1454,Kemonozume,ケモノヅメ,7.34,2530.0,2516,summer,2006.0,"Action, Avant Garde, Horror, Romance, Supernatural",
1482,D.Gray-man,ディー・グレイマン,8.0,638.0,295,fall,2006.0,"Action, Adventure, Fantasy",Shounen
1498,Black Blood Brothers,ブラック・ブラッド・ブラザーズ,7.09,3830.0,2074,fall,2006.0,"Action, Comedy, Fantasy",
1509,Mamotte! Lollipop,まもって！ロリポップ,6.61,6178.0,4410,summer,2006.0,"Adventure, Comedy, Romance",Shoujo
1516,Kirarin☆Revolution,きらりん☆レボリューション,7.07,3912.0,3948,spring,2006.0,"Comedy, Drama, Romance",Shoujo
1519,Black Lagoon: The Second Barrage,BLACK LAGOON The Second Barrage,8.17,422.0,427,fall,2006.0,Action,Seinen
1530,Kanon (2006),カノン (2006),7.94,707.0,911,fall,2006.0,"Drama, Romance, Supernatural",
1534,Futari wa Precure: Splash☆Star,ふたりはプリキュア Splash☆Star,7.18,3380.0,5582,winter,2006.0,"Action, Comedy, Fantasy",
1535,Death Note,デスノート,8.62,84.0,2,fall,2006.0,"Supernatural, Suspense",Shounen
1536,Busou Renkin,武装錬金,7.29,2752.0,1390,fall,2006.0,"Action, Fantasy",Shounen
1538,Pumpkin Scissors,パンプキン・シザーズ,7.15,3503.0,3419,fall,2006.0,"Action, Comedy, Drama",Shounen
1541,Souten no Ken,蒼天の拳,6.68,5770.0,5891,fall,2006.0,Action,
1543,Yoake Mae yori Ruriiro na: Crescent Love,夜明け前より瑠璃色な -Crescent Love-,7.09,3818.0,3546,fall,2006.0,"Comedy, Romance, Sci-Fi",
1546,Negima!?,ネギま!?,6.93,4543.0,2188,fall,2006.0,"Comedy, Fantasy, Romance, Ecchi",
1554,Asatte no Houkou.,あさっての方向。,7.02,4117.0,4489,fall,2006.0,"Drama, Supernatural",
1555,Tokimeki Memorial: Only Love,ときめきメモリアル Only Love,7.01,4178.0,3711,fall,2006.0,"Comedy, Romance",
1557,Shounen Onmyouji,少年陰陽師,7.53,1779.0,2992,fall,2006.0,"Action, Fantasy",Shoujo
1559,Shijou Saikyou no Deshi Kenichi,史上最強の弟子 ケンイチ,8.04,588.0,809,fall,2006.0,"Action, Comedy",Shounen
1561,Lovedol: Lovely Idol,らぶドル～Lovely Idol～,6.11,8961.0,6773,fall,2006.0,,
1562,Yamato Nadeshiko Shichihenge♥,ヤマトナデシコ七変化♥,7.71,1229.0,1472,fall,2006.0,Comedy,Shoujo
1565,Pokemon Diamond & Pearl,ポケットモンスター ダイヤモンド&パール,7.29,2777.0,1567,fall,2006.0,"Action, Adventure, Comedy, Fantasy",Kids
1568,Sumomomo Momomo: Chijou Saikyou no Yome,すもももももも〜地上最強のヨメ〜,6.83,5016.0,2685,fall,2006.0,"Action, Comedy, Romance",Seinen
1569,Otome wa Boku ni Koishiteru,乙女は僕に恋してる,7.02,4156.0,2801,fall,2006.0,"Comedy, Drama, Romance",
1570,Happiness!,はぴねす！,6.34,7719.0,3758,fall,2006.0,"Comedy, Romance",
1571,Ghost Hunt,ゴーストハント,7.75,1129.0,1070,fall,2006.0,"Horror, Mystery, Supernatural",Shoujo
1575,Code Geass: Hangyaku no Lelouch,コードギアス 反逆のルルーシュ,8.7,58.0,22,fall,2006.0,"Action, Award Winning, Drama, Sci-Fi",
1578,Koisuru Tenshi Angelique: Kokoro no Mezameru Toki,恋する天使アンジェリーク　～心のめざめる時～,6.81,5096.0,5997,summer,2006.0,"Adventure, Comedy, Drama, Fantasy, Romance, Sci-Fi",Shoujo
1579,Kiniro no Corda: Primo Passo,金色のコルダ ～primo passo～,7.41,2225.0,2154,fall,2006.0,Romance,Josei
1581,Gift: Eternal Rainbow,ギフト～ eternal rainbow,6.55,6550.0,4031,fall,2006.0,"Comedy, Drama, Romance",
1583,009-1,ゼロゼロナインワン,6.21,8389.0,4755,fall,2006.0,"Action, Sci-Fi",Seinen
1587,Tenpou Ibun: Ayakashi Ayashi,天保異聞 妖奇士,6.84,4975.0,5238,fall,2006.0,Supernatural,
1588,Mamoru-kun ni Megami no Shukufuku wo!,護くんに女神の祝福を！,7.02,4147.0,4304,fall,2006.0,"Comedy, Romance",
1589,Bartender,バーテンダー,7.32,2600.0,2151,fall,2006.0,"Drama, Gourmet",Seinen
1591,Kujibiki♥Unbalance,くじびき♥アンバランス,6.22,8349.0,5617,fall,2006.0,"Comedy, Romance",
1592,Hataraki Man,働きマン,6.99,4270.0,4378,fall,2006.0,"Comedy, Drama, Romance",Seinen
1594,Jigoku Shoujo Futakomori,地獄少女 二籠,7.88,833.0,1466,fall,2006.0,"Horror, Mystery, Supernatural",
1600,Galaxy Angel Rune,ギャラクシーエンジェる～ん,6.21,8405.0,8073,fall,2006.0,"Comedy, Sci-Fi",
1601,Red Garden,レッド ガーデン,7.03,4086.0,3325,fall,2006.0,"Drama, Mystery, Supernatural",
1602,Soukou no Strain,奏光のストレイン,7.0,4229.0,4649,fall,2006.0,"Action, Drama, Sci-Fi, Ecchi",
1603,Super Robot Taisen OG: Divine Wars,スーパーロボット大戦OG -ディバイン・ウォーズ-,6.77,5287.0,7018,fall,2006.0,"Action, Sci-Fi",
1604,Katekyou Hitman Reborn!,家庭教師ヒットマンREBORN!,8.12,478.0,399,fall,2006.0,"Action, Comedy",Shounen
1606,Kekkaishi,結界師,7.59,1562.0,1980,fall,2006.0,"Action, Adventure, Supernatural",Shounen
1607,Venus Versus Virus,ヴィーナス ヴァーサス ヴァイアラス,6.32,7787.0,4113,winter,2007.0,"Drama, Romance, Supernatural",
1655,Nerima Daikon Brothers,練馬大根ブラザーズ,7.26,2960.0,6719,winter,2006.0,Comedy,
1688,Nanatsu-iro★Drops,ななついろ★ドロップス,6.99,4277.0,4651,summer,2007.0,Romance,
1690,Bokura no,ぼくらの,7.6,1533.0,1265,spring,2007.0,"Action, Drama, Sci-Fi, Suspense",Seinen
1691,Kaze no Stigma,風のスティグマ,7.16,3472.0,505,spring,2007.0,"Action, Fantasy, Romance",
1693,Reideen,ライディーン,6.51,6778.0,6708,winter,2007.0,"Action, Sci-Fi",
1694,iDOLM@STER Xenoglossia,アイドルマスター XENOGLOSSIA（ゼノグラシア）,6.46,7064.0,4624,spring,2007.0,"Action, Comedy, Sci-Fi",
1695,Les Misérables: Shoujo Cosette,レ・ミゼラブル 少女コゼット,7.9,778.0,4113,winter,2007.0,Drama,
1698,Nodame Cantabile,のだめカンタービレ,8.26,306.0,775,winter,2007.0,"Comedy, Romance",Josei
1699,Romeo x Juliet,ロミオ×ジュリエット,7.58,1578.0,1320,spring,2007.0,"Drama, Fantasy, Romance",
1703,Tokyo Tribe 2,TOKYO TRIBE 2,6.63,6088.0,6008,fall,2006.0,"Action, Drama",
1721,Hitohira,ひとひら,6.72,5554.0,4894,spring,2007.0,"Drama, Romance",Seinen
1722,Nagasarete Airantou,ながされて藍蘭島,7.21,3181.0,2078,spring,2007.0,"Comedy, Fantasy, Romance, Ecchi",Shounen
1724,Saint October,セイントオクトーバー,6.47,6975.0,7346,winter,2007.0,"Adventure, Fantasy",
1726,Devil May Cry,デビル メイ クライ,6.93,4517.0,789,summer,2007.0,"Action, Fantasy",
1727,Shinkyoku Soukai Polyphonica,神曲奏界ポリフォニカ,6.78,5246.0,4045,spring,2007.0,"Drama, Fantasy, Romance",
1738,Muteki Kanban Musume,無敵看板娘,7.07,3888.0,4854,summer,2006.0,"Action, Comedy",Shounen
1739,Shibawanko no Wa no Kokoro,しばわんこの和のこころ,,13601.0,14539,spring,2006.0,,Kids
1740,Naikaku Kenryoku Hanzai Kyousei Torishimarikan Zaizen Joutarou,内閣権力犯罪強制取締官・財前丈太郎,5.13,12559.0,11184,summer,2006.0,"Action, Drama",Seinen
1771,Ring ni Kakero 1: Nichibei Kessen-hen,リングにかけろ1 日米決戦編,6.49,6872.0,10398,spring,2006.0,Sports,Shounen
1807,Prism Ark,プリズム・アーク,6.4,7409.0,4672,fall,2007.0,"Action, Comedy, Fantasy, Romance",
1808,Kamichama Karin,かみちゃまかりん,7.19,3277.0,3084,spring,2007.0,"Comedy, Fantasy, Romance",Shoujo
1810,Kyoushirou to Towa no Sora,京四郎と永遠（とわ）の空,6.39,7457.0,3437,winter,2007.0,"Drama, Fantasy, Romance",Shounen
1812,Hanoka,HANOKA～葉ノ香～,3.37,13375.0,8465,summer,2006.0,Sci-Fi,
1818,Claymore,クレイモア,7.73,1170.0,309,spring,2007.0,"Action, Adventure, Fantasy",Shounen
1826,Deltora Quest,デルトラクエスト,7.08,3849.0,4132,winter,2007.0,"Adventure, Fantasy",Kids
1827,Seirei no Moribito,精霊の守り人,8.13,470.0,1121,spring,2007.0,"Action, Adventure, Fantasy",
1835,Ryuusei no Rockman,流星のロックマン,7.09,3819.0,5698,fall,2006.0,"Action, Sci-Fi",
1836,Shuffle! Memories,シャッフル！メモリーズ,6.52,6673.0,2997,winter,2007.0,"Comedy, Drama, Fantasy, Romance, Ecchi",
